,year,subject,content
111,2017,internship position available at  softbank robotics (paris)," established in 2005, softbank robotics (formerly aldebaran) has 450 employees and is headquartered in france with offices in china, japan and the united states. for almost 10 years, softbank robotics has been driving technology into a new world by designing humanoid robots and has become the worldwide leader in humanoid robotics. our robots (nao, pepper, romeo) are used in more than 70 countries in various fields, such as research, education, retail, care, tourism or entertainment. for the future, softbank robotics has embraced the ambitious goal of developing humanoid robots for everyone. softbank robotics believes that in coming years robots will positively impact our lives to the same extent as pcs and mobile devices did during the past 3 decades. robots will change the way we learn, work and communicate. mission ========= within the expressivity team, you will develop software to ensure an expressive, natural and fun interactions between softbank robotics robots and the people around them. you will work on a system to detect when a human physically interacts with a robot's body, such as pulling on its arm, opening its hand, etc. the goal is to allow our robots to have lifelike reactions to these human interactions. you will lead the creation of a database of samples, for use in algorithm creation and testing. the software algorithms you write will be robust within real-world environments. main tasks ========= - create a dataset of annotated physical interactions containing sensor values within a human-robot interaction - extract pertinent features, if applicable - choose and customize a machine learning method to work with real-world hri data who we're looking for ==================== you have a background in signal processing and machine learning, ideally in a robotics environment. the ideal candidate will have the ability to write optimised algorithms and code with low cpu consumption, to be embedded in a robot. you will gain experience in agile development methodologies and delivering high-quality software to customers. prior experience with nao or pepper is highly appreciated. dynamic, autonomous and with good programming skills in python, you have a passion for human-robot interaction, artificial intelligence or cognitive science. love new challenges and want to participate in an adventure out of the ordinary? send us your application (resume + cover letter) at recrutement at softbankrobotics.com this position is available immediately, for an internship between 3-6 months. --  angelica lim, ph.d. software engineering manager softbank robotics europe https://urldefense.proofpoint.com/v2/url?u=https-3a__www.ald.softbankrobotics.com&d=dwifaq&c=clk7kqutwtaveovigvi0nu5bouhhpn0h8p7csfnc_gi&r=0w3solp5fswiywf2rl6rss8mcefamfepafdtohgtfyi&m=ch_lqhfgnouurss0obhgunahbbf5r0jjadywcu6lo9a&s=vf3hptwe0pgwhgqbkgpzoq-c7dshp29exm896jn9meu&e=  <https://urldefense.proofpoint.com/v2/url?u=https-3a__www.ald.softbankrobotics.com&d=dwmfaq&c=clk7kqutwtaveovigvi0nu5bouhhpn0h8p7csfnc_gi&r=0w3solp5fswiywf2rl6rss8mcefamfepafdtohgtfyi&m=idvojapqkrrlipsgd_viv19egalovkj7gz5fgm4wc4y&s=yagd1iiezajkd8sh0qjhwa1uxsxeqapkgqyajcg7tx8&e=> --  *this email and any attachment thereto are confidential and intended solely  for the use of the individual or entity to whom they are addressed.if you  are not the intended recipient, please be advised that disclosing, copying,  distributing or taking any action in reliance on the contents of this email  is strictly prohibited. in such case, please immediately advise the sender,  and delete all copies and attachment from your system.this email shall not  be construed and is not tantamount to an offer, an acceptance of offer, or  an agreement by softbank robotics europe on any discussion or contractual  document whatsoever. no employee or agent is authorized to represent or  bind softbank robotics europe to third parties by email, or act on behalf  of softbank robotics europe by email, without express written confirmation  by softbank robotics europe? duly authorized representatives.* ------------------------------ *ce message ?lectronique et ?ventuelles pi?ces jointes sont confidentiels,  et exclusivement destin?s ? la personne ou l'entit? ? qui ils sont  adress?s.vous n'?tes pas le destinataire vis?, vous ?tes pri? de ne pas  divulguer, copier, distribuer ou prendre toute d?cision sur la foi de ce  message ?lectronique. merci d'en aviser imm?diatement l'exp?diteur et de  supprimer toutes les copies et ?ventuelles pi?ces jointes de votre  syst?me.ce message ?lectronique n'?quivaut pas ? une offre, ? une  acceptation d?offre, ou ? un accord de softbank robotics europe sur toute  discussion ou document contractuel quel qu?il soit, et ne peut ?tre  interpr?t? comme tel. aucun employ? ou agent de softbank robotics europe  n'est autoris? ? repr?senter ou ? engager la soci?t? par email, ou ? agir  au nom et pour le compte de la soci?t? par email, sans qu?une confirmation  ?crite soit donn?e par le repr?sentant l?gal de softbank robotics europe ou  par toute autre personne ayant re?u d?l?gation de pouvoir appropri?e.*"
112,2017,"scientist position at honda research  institute usa, inc."," honda research institute usa (hri-us) in silicon valley is searching for a talented scientist with expertise in artificial intelligence and machine learning to join our cutting-edge research in the exciting future of autonomous vehicles. as a member of the group, we encourage the candidates to contribute new research ideas and to participate in presentations and scientific publications. you will also have the opportunity to build close relationships with our research partners at world-class universities and at other honda research institutes in europe and japan to create cutting edge solutions to complex and real world problems. scientist: decision making/motion planning (job number: p16f05): the position focuses on bringing machine learning techniques to real-world decision making problems. it has a strong emphasis on real problems with real solutions and requires broad knowledge in the areas such as reinforcement learning, deep learning and policy optimization. key responsibilities: - perform research to make machine learning applicable to real world decision making problems. - develop decision making and motion planning algorithms for autonomous vehicles. - participate in software development and prototyping. - contribute to a portfolio of patents and academic publications demonstrate research value. minimum qualifications: - phd/msc in computer science, electrical engineering, or related field. - expertise in machine learning. - expertise in decision making under uncertainty. - familiarity with motion planning algorithms. - strong programming skills in python or c++ preferred qualifications: - experience in reinforcement learning and/or deep learning. - experience in behavior cloning. - familiarity with probabilistic reasoning in ai. - experience in deep learning frameworks such as tensorflow. - familiarity with robot operating system (ros). the candidate must possess excellent interpersonal and communication skills, eagerness to learn and grow, and have a flexible approach to solving problems. application instructions: please send an e-mail to careers at honda-ri.com with the following: - subject line including the job number you are applying for - recent cv - a cover letter explaining how your background matches the qualifications candidates must have the legal right to work in the u.s.a. regards, alireza nakhaei honda research institute usa, inc. 375 ravendale dr. mountain view, ca, 94043 confidentiality notice: this transmission (including any attachments) may contain confidential information belonging to the sender and is intended only for the use of the party or entity to which it is addressed. if you are not the intended recipient, you are hereby notified that any disclosure, copying, distribution, retention or the taking of action in reliance on the contents of this transmission is strictly prohibited. if you have received this transmission in error, please immediately notify the sender and erase all information and attachments."
113,2017,associate professor position in osaka  university," dear robotics researchers; we are looking for an associate professor who can work at osaka university, japan. -------- 1. available job position:  one associate professor 2. place:         1-3 machikaneyama, toyonaka, japan         graduate school of engineering science, osaka university 3. institution:         department of systems innovation, graduate school of engineering science,         osaka university 4. professional area: robotics 5. job description        education of intelligent systems        research on robotic manipulation 6. qualification: ph.d. 7. starting date: 1/10/2017 8. necessary documents       1. cv(face picture, address, contact information, education and professions etc)       2. list of papers(journal papers, conference papers, books, article, patents etc)       3. copies of five major papers       4. abstract of major research achievements (2 pages for the research included in the list of papers)       5. plan of your research and education (2 pages)       6. award and activities in academic society       7. other information (such as grant information) 9. application deadline: 31/7/2017 10. how to apply:      send the necessary documents to       kensuke harada, ph.d.       1-3 machikaneyama       department of systems innovations, graduate school of engineering science       osaka university, toyonaka 560-8531, japan 11. contact information       kensuke harada       e-mail: harada at sys.es.osaka-u.ac.jp ------ information https://urldefense.proofpoint.com/v2/url?u=http-3a__www.es.osaka-2du.ac.jp_ja_department_graduate_sys.html&d=dwibaq&c=clk7kqutwtaveovigvi0nu5bouhhpn0h8p7csfnc_gi&r=0w3solp5fswiywf2rl6rss8mcefamfepafdtohgtfyi&m=qbqu-sckbrqwgaer7osioqrz8p6bejbykb5p2o5okyc&s=mnqljuueycmoihcdnf_987gefefhexjecl1z9f1hmic&e=  https://urldefense.proofpoint.com/v2/url?u=http-3a__www.es.osaka-2du.ac.jp_ja_department_graduate_sys2.html&d=dwibaq&c=clk7kqutwtaveovigvi0nu5bouhhpn0h8p7csfnc_gi&r=0w3solp5fswiywf2rl6rss8mcefamfepafdtohgtfyi&m=qbqu-sckbrqwgaer7osioqrz8p6bejbykb5p2o5okyc&s=dnhcmartpkqcsjiusu4ew4tqd8xfq5abwdh0zynt7ms&e=  https://urldefense.proofpoint.com/v2/url?u=http-3a__www.es.osaka-2du.ac.jp_ja_department_school_sci.html-23sci2&d=dwibaq&c=clk7kqutwtaveovigvi0nu5bouhhpn0h8p7csfnc_gi&r=0w3solp5fswiywf2rl6rss8mcefamfepafdtohgtfyi&m=qbqu-sckbrqwgaer7osioqrz8p6bejbykb5p2o5okyc&s=8ppxayqcaxuuzdimfchpjcg5anjygksbmiwlr4p9bha&e=              https://urldefense.proofpoint.com/v2/url?u=http-3a__www.es.osaka-2du.ac.jp_ja_offering_recruitment_&d=dwibaq&c=clk7kqutwtaveovigvi0nu5bouhhpn0h8p7csfnc_gi&r=0w3solp5fswiywf2rl6rss8mcefamfepafdtohgtfyi&m=qbqu-sckbrqwgaer7osioqrz8p6bejbykb5p2o5okyc&s=whqdmem0rel-xswjt1e8ytlwwgwzvaycjpue2qhrbmi&e=  trecruitement-year-2017/20170526-025704.html --  kensuke harada, professor graduate school of engineering science, osaka university cross appointment fellow, aist tel: +81-6-6850-6380, e-mail: harada at sys.es.osaka-u.ac.jp web: https://urldefense.proofpoint.com/v2/url?u=http-3a__www.hlab.sys.es.osaka-2du.ac.jp_people_harada&d=dwibaq&c=clk7kqutwtaveovigvi0nu5bouhhpn0h8p7csfnc_gi&r=0w3solp5fswiywf2rl6rss8mcefamfepafdtohgtfyi&m=qbqu-sckbrqwgaer7osioqrz8p6bejbykb5p2o5okyc&s=vxj_doafhkp10zez2sovsc47c-gl6_hfjufn0-q8qtw&e= "
114,2017,software engineer 2 years for a robot  simulator development," software engineer staff in robotics opening we are opening a 2-years position for a robotic software engineer to work on the development  and maintenance of software for the dynamics simulation of robots, choreonoid (www.choreonoid.org). the engineer will be in charge of the following tasks:    -  maintaining the simulation software so that the actual platforms are always up-to-date,    -  debugging the simulation software,    -  improving the simulation software,    -  porting programs developed for gazebo,    -  writing documents and creating examples requirements:    -  very good skills in programming and integration in c++ and python,    -  good knowledge of development tool-chain and of development management       tools (git, cmake, github, travis, etc.)    -  knowledge of robotics middleware ros and simulator gazebo,    -  good oral and written level in english or japanese. working hour: from monday to friday, 7hours and 45minutes per day (9:00-17:45 including one hour break) holidays: saturday, sunday and national holidays working place: humanoid research group, intelligent systems research institute, aist aist central 1, 1-1-1 umezono, 305-8560, tsukuba, japan salary: from 950 to 3,000 japanese yen/hour depending on the experience. income tax and social insurance premium are deducted form the salary. starting date of employment: 2017/10/1"
115,2017,robotics engineer 2 years for a  humanoid robot development," engineer staff in robotics opening we are opening a 2-years position for a robotic engineer to work on:    1. the development and maintenance of software for humanoid robots,    2. the testing of software on the real robots, the engineer will be in charge of the following tasks:    -  maintaining the control software, so that the actual robots are always       up-to-date and the software can work readily on the robot,    -  performing hardware upgrade when new options are available (new        embedded gpu, low-cost rgbd cameras, tactile sensors, and more generally        perception sensors),    -  consulting with the research team to build and settle experimental        set-ups,    -  enforcing the security rules for real experimentations. requirements:    -  very good skills in programming and integration in c++ and python,    -  good knowledge of development tool-chain and of development management        tools (git, cmake, continuous integration, etc.)    -  knowledge of classical robotics middleware (e.g. ros) and real-time       software,    -  good oral and written level in english, especially in technical english,    -  knowledge in robotics. employment duration: the contract needs to be renewed annually. the renewal is up to march 31st 2019. working hour: from monday to friday, 7hours and 45minutes per day (9:00-17:45 including one hour break) holidays: saturday, sunday and national holidays working place: humanoid research group, intelligent systems research institute, aist aist central 1, 1-1-1 umezono, 305-8560, tsukuba, japan salary: from 950 to 3,000 japanese yen/hour depending on the experience. income tax and social insurance premium are deducted from the salary. starting date of employment: 2017/10/1 send your cv and motivation letter to fumio kanehiro, aist-is humanoid research group, tsukuba, japan f-kanehiro at aist.go.jp an interview will be conducted for each profile fitting the requirement."
116,2017,postdoc 3 years for multi-contact  motion planning of a humanoid robot," engineer staff in robotics opening we are opening a 3-years position for a postdoc to work on multi-contact motion planning of a humanoid robot. the postdoc will be in charge of the following tasks:    -  developing a multi-contact motion planning algorithm that can be used for       a standing up motion planning, whole-body locomotion and whole-body manipulation.      -  implementing the algorithm on our software environment,    -  testing the planned motions with our multi-contact motion controller. requirements:    -  knowledge in kinematics/dynamics and motion planning of humanoid robots,    -  very good skills in programming and integration in c++,    -  good knowledge of development tool-chain and of development management        tools (git, cmake, continuous integration, etc.)    -  good oral and written level in english, especially in technical english. employment duration: the contract needs to be renewed annually. the renewal is up to twice (up to march 31st 2020). working hour: from monday to friday, 7hours and 45minutes per day (9:00-17:45 including one hour break) holidays: saturday, sunday and national holidays working place: humanoid research group, intelligent systems research institute, aist aist central 1, 1-1-1 umezono, 305-8560, tsukuba, japan salary: from 2,200 to 2,500 japanese yen/hour depending on the experience. income tax and social insurance premium are deducted from the salary. starting date of employment: 2017/10/1 send your cv and motivation letter to fumio kanehiro, aist-is humanoid research group, tsukuba, japan f-kanehiro at aist.go.jp an interview will be conducted for each profile fitting the requirement."
117,2017,"full professor position in aerospace  engineering, tohoku university, japan"," tenure position at professor level (aerospace engineering) the department of aerospace engineering invites applications for a   tenure position at the professor level. the successful applicant will   join the astronautical engineering group of the department. the   astronautical engineering group is currently active in propulsion   engineering and space exploration. special preference will be given to   those applicants who have a strong background and interest in mechanics   of space flight systems, then conduct cutting-edge research in the areas   such as space structures, multibody dynamics, control theory and   astrodynamics. at present, there are 25 professors and 25 associate professors in the   divition of mechanical engineering, (which is composed of the following   four departments; mechanical systems engineering, finemechanics,   robotics and aerospace engineering,) pursuing research and teaching in areas such as functional systems engineering, energy systems   engineering, materials physics and engineering, nanomechanics,   biomechanics, robot systems, nanosystems, aeronautical engineering,   astronautical engineering and other fields newly created by fusion of   different fields. particularly, department of aerospace engineering is   featured by collaborative laboratories with japan aerospace exploration   agency (jaxa) for strategic contribution to jaxa's space programs. the successful candidate is expected to set up innovative research   projects by himself/herself or in collaboration with other researchers   of the division of mechanical engineering. responsibilities will include   teaching at both the undergraduate and graduate levels, and directing   research projects, which will lead to ms and ph.d. theses. the position is open to any candidate who holds a doctoral degree in an   appropriate field regardless of gender or nationality. profound knowledge of the japanese or english language, written and   spoken, is also required for the candidate. the successful applicant, of japanese or non-japanese nationality, will   become a japanese national university corporation employee and will be   paid accordingly. salary, working hours, holiday, period of employment are determined   based on the rules of tohoku university. insurance and accommodation are   also treated based on the rules of tohoku university. applications will be reviewed until the position is filled; all   applications received by august 31st, 2017 will be considered. the   position is available from april 1, 2018. interested applicants should submit the application including (1) a resume, (2) a statement of teaching and research interests, (3) a list of publications, copies of five principal publications, and (4) names, addresses, phone numbers, and e-mail addresses of five   references. selection will be made based on all application documents   submitted.interviews will be conducted as needed. submitted application documents will not be returned. [contact details] prof. keisuke sawada chair, department of aerospace engineering, graduate school of   engineering, tohoku university aoba 6-6-01, sendai 980-8579, japan e-mail: sawada at cfd.tohoku.ac.jp, phone: +81-22-795-6920, fax:   +81-22-795-6920 https://urldefense.proofpoint.com/v2/url?u=http-3a__www.mech.tohoku.ac.jp_e_pdf_ase-5f170630-5fe.pdf&d=dwicjg&c=clk7kqutwtaveovigvi0nu5bouhhpn0h8p7csfnc_gi&r=0w3solp5fswiywf2rl6rss8mcefamfepafdtohgtfyi&m=hqfktco4mhbwarh5z-xl2br2vipx3m6e9kb2czl8zdm&s=wxy4hzf8pmylx0kbocn4nznss9k0uuv9y4xuuqin0ve&e=  https://urldefense.proofpoint.com/v2/url?u=https-3a__jrecin.jst.go.jp_seek_seekjordetail-3ffn-3d2-26ln-3d1-26id-3dd117070320-26ln-5fjor-3d1&d=dwicjg&c=clk7kqutwtaveovigvi0nu5bouhhpn0h8p7csfnc_gi&r=0w3solp5fswiywf2rl6rss8mcefamfepafdtohgtfyi&m=hqfktco4mhbwarh5z-xl2br2vipx3m6e9kb2czl8zdm&s=fofv_5-ojhmnclspwqebfn2wxn6e_9gv6u90xlnfvpm&e= "
