,year,subject,content
0,2015,xyzprinting company limited," ?dear all, foward for your information. a job opportunity for computer vision experts. appologies for multiple e-mail. thank you and regards ----------------- waqar s. qureshi asian institute of technology(ait) po box 4, klongluang pathumthani, 12120 thailand mobile:+66891771716 website:http://www.cs.ait.ac.th/~st111211 ??"
1,2017,"fully funded ms/phd student positions  in data science, bio-inspired robotics, and neural engineering at ist,  vistec, thailand in-reply-to: <sg2pr0601mb12965ed1e584ccc2bbc0592ea8220@sg2pr0601mb1296.apcprd06.prod.outlook.com> references: <sg2pr0601mb12965ed1e584ccc2bbc0592ea8220@sg2pr0601mb1296.apcprd06.prod.outlook.com>"," dear colleagues, the school of information science and technology (ist) at vidyasirimedhi institute of science and technology (vistec), thailand, welcomes all applicants for our international master?s and doctoral degree program. our school offers a competitive, english language, interdisciplinary, world-class phd training and research program in information science and technology. we have 20 fully funded master and phd student positions. our program includes 2-years ms, 5-years ms+phd, and 3-years phd options. the students will be formally affiliated with the master/phd program at ist, vistec, thailand. they will have the opportunity to develop new algorithms and research ideas and perform experiments on real hardware, e.g., high performance computing, advanced robotic systems, exoskeleton, and brain computer interface systems. our basic research under the ist umbrella focuses on main areas: data science, cloud/hpc, iot, bio-inspired robotics, and neural engineering. data science and engineering (large-scale analytics, data engineering, data mining, artificial intelligence and machine learning): we address various scalability issues in machine learning, data mining, database query processing. we are especially interested in developing solutions for machine learning problems with an extremely large number of classes and a scalable system for managing and storing various forms of high-dimensional data. our application domains include (but not limited to) natural language processing, time series data management, geospatial data mining, business intelligence, iot data analytics, and health data analytics. bio-inspired robotics: we address how to develop brain-like mechanisms for adaptive motor control and autonomous learning of embodied multi-sensorimotor robotic systems (i.e., bio-inspired robots, exoskeleton). we also transfer the developed mechanisms (brain technology) to application areas like human-machine interaction, brain-machine interface, and rehabilitation (see www.brain.vistec.ac.th<https://urldefense.proofpoint.com/v2/url?u=http-3a__www.brain.vistec.ac.th&d=dwif-g&c=clk7kqutwtaveovigvi0nu5bouhhpn0h8p7csfnc_gi&r=0w3solp5fswiywf2rl6rss8mcefamfepafdtohgtfyi&m=8tlbcg4fgpzn66itm9347mddgqpp1z65dwuxdlpczgw&s=fha2_oc55h_cry10h_dxe3iyhtvxud9jk1rdlmd9w64&e=>  for more details). neural engineering: we address an investigation of closed-loop eeg-based brain computer interface (bci) helps bridge the gap in communication between man and machine. understanding patterns of brain activity from basic neuroscience research will help engineering to optimize the bci system that could be applied in the real-world environment. advanced signal processing techniques and pattern recognition methods such as machine learning, artificial neural network, and deep learning can improve the efficiency of bci by increasing information transfer rate and accuracy. ultimately, research based on bci could lead to the development of novel tools used in both clinical and healthy populations (see www.brain.vistec.ac.th<https://urldefense.proofpoint.com/v2/url?u=http-3a__www.brain.vistec.ac.th&d=dwif-g&c=clk7kqutwtaveovigvi0nu5bouhhpn0h8p7csfnc_gi&r=0w3solp5fswiywf2rl6rss8mcefamfepafdtohgtfyi&m=8tlbcg4fgpzn66itm9347mddgqpp1z65dwuxdlpczgw&s=fha2_oc55h_cry10h_dxe3iyhtvxud9jk1rdlmd9w64&e=>  for more details). financial support: this studentship includes 1) fee bursary to cover the tuition fee rate 2) a maintenance allowance during the study, 3) grant of 1 million bath scholarship for international research experience. person specification: the successful applicant from any nationality will have a strong undergraduate (first class or upper second class) and/or master?s degree in 1) science (physics, mathematics, computer and related fields) 2)engineering (computer, mechanical, electrical, robotics, and related fields) 3) applied science (information technology, ict, machine learning, and related fields) applicants with excellent programming and analytical/mathematical skills as well as expertise and research interests lying at the intersection of data science, bio-inspired robotics, and neural engineering are particularly welcome to apply. applicants from non-english speaking countries will need to satisfy english language entry requirements. application documents: 1. cv 2. official transcripts 3. statement of purpose/ statement of research interest optional: 4. letters of recommendation 5. english test score (toefl, ielts, or other tests) 6. publications, awards & honors 7. portfolio and other relevant documents applications should be submitted online by january 31st , 2018. https://urldefense.proofpoint.com/v2/url?u=http-3a__www.vistec.in.th_admission_form.php&d=dwif-g&c=clk7kqutwtaveovigvi0nu5bouhhpn0h8p7csfnc_gi&r=0w3solp5fswiywf2rl6rss8mcefamfepafdtohgtfyi&m=8tlbcg4fgpzn66itm9347mddgqpp1z65dwuxdlpczgw&s=cn9hnb17yv1bddol6_hefjxnlf2ejywagroays-pnko&e= https://urldefense.proofpoint.com/v2/url?u=http-3a__www.vistec.in.th_admission_&d=dwif-g&c=clk7kqutwtaveovigvi0nu5bouhhpn0h8p7csfnc_gi&r=0w3solp5fswiywf2rl6rss8mcefamfepafdtohgtfyi&m=8tlbcg4fgpzn66itm9347mddgqpp1z65dwuxdlpczgw&s=6bmhccc_q8hkg97xxjjahlwk3ikg9hvnuxhki3trjsa&e= for further information or questions please contact box leangsuksun e-mail: chokchai.l at vistec.ac.th<mailto:chokchai.l at vistec.ac.th> vidyasirimedhi institute of science and technology, wangchan valley 555 moo1 payupnai, wangchan, rayong 21210 thailand tel: +6633-01-4116 website of vistec: https://urldefense.proofpoint.com/v2/url?u=http-3a__www.vistec.ac.th&d=dwif-g&c=clk7kqutwtaveovigvi0nu5bouhhpn0h8p7csfnc_gi&r=0w3solp5fswiywf2rl6rss8mcefamfepafdtohgtfyi&m=8tlbcg4fgpzn66itm9347mddgqpp1z65dwuxdlpczgw&s=ootq5own13stepqqpa_4mjrxwmz7dsrohmdgmqgna-s&e="
2,2018,"fully funded ms/phd student positions  in data science, computer vision, bio-inspired robotics,  and neural engineering at ist, vistec, thailand"," dear colleagues, the school of information science and technology (ist) at vidyasirimedhi institute of science and technology (vistec), thailand, welcomes all applicants for our international master's and doctoral degree program. our school offers a competitive, english language, interdisciplinary, world-class phd training and research program in information science and technology. we have up to 20 fully funded master and phd student positions. our program includes 2-years ms, 5-years ms+phd, and 3-years phd options. the students will be formally affiliated with the master/phd program at ist, vistec, thailand. they will have the opportunity to develop new algorithms and research ideas and perform experiments on real hardware, e.g., high performance computing, big data, computer vision, advanced robotic systems, exoskeleton, and brain computer interface systems. our basic research under the ist umbrella focuses on main areas: data science, cloud/hpc, computer vision, iot, bio-inspired robotics, and neural engineering. data science and engineering (large-scale analytics, data engineering, data mining, artificial intelligence and machine learning): we address various scalability issues in machine learning, data mining, database query processing. we are especially interested in developing solutions for machine learning problems with an extremely large number of classes and a scalable system for managing and storing various forms of high-dimensional data. our application domains include (but not limited to) natural language processing, time series data management, geospatial data mining, business intelligence, iot data analytics, and health data analytics. bio-inspired robotics: we address how to develop brain-like mechanisms for adaptive motor control and autonomous learning of embodied multi-sensorimotor robotic systems (i.e., bio-inspired robots, exoskeleton). we also transfer the developed mechanisms (brain technology) to application areas like human-machine interaction, brain-machine interface, and rehabilitation (see https://urldefense.proofpoint.com/v2/url?u=https-3a__brain.vistec.ac.th_&d=dwifaw&c=clk7kqutwtaveovigvi0nu5bouhhpn0h8p7csfnc_gi&r=0w3solp5fswiywf2rl6rss8mcefamfepafdtohgtfyi&m=d-wpnsg6jnuvoalsebenagdplmqqzhgldqrtpvctywu&s=ityytc0ermvcxfupowqku1njmy9bfwrjbuqedni1_vk&e=  for more details). neural engineering: we address an investigation of closed-loop eeg-based brain computer interface (bci) helps bridge the gap in communication between man and machine. understanding patterns of brain activity from basic neuroscience research will help engineering to optimize the bci system that could be applied in the real-world environment. advanced signal processing techniques and pattern recognition methods such as machine learning, artificial neural network, and deep learning can improve the efficiency of bci by increasing information transfer rate and accuracy. ultimately, research based on bci could lead to the development of novel tools used in both clinical and healthy populations (see https://urldefense.proofpoint.com/v2/url?u=https-3a__brain.vistec.ac.th_&d=dwifaw&c=clk7kqutwtaveovigvi0nu5bouhhpn0h8p7csfnc_gi&r=0w3solp5fswiywf2rl6rss8mcefamfepafdtohgtfyi&m=d-wpnsg6jnuvoalsebenagdplmqqzhgldqrtpvctywu&s=ityytc0ermvcxfupowqku1njmy9bfwrjbuqedni1_vk&e=  for more details). financial support: this studentship includes 1) fee bursary to cover the tuition fee rate 2) a maintenance allowance during the study, 3) grant of 1 million bath scholarship for international research experience. person specification: the successful applicant from any nationality will have a strong undergraduate (first class or upper second class) and/or master's degree in 1) science (physics, mathematics, computer and related fields) 2)engineering (computer, mechanical, electrical, robotics, and related fields) 3) applied science (information technology, ict, machine learning, and related fields) applicants with excellent programming and analytical/mathematical skills as well as expertise and research interests lying at the intersection of data science, bio-inspired robotics, and neural engineering are particularly welcome to apply. applicants from non-english speaking countries will need to satisfy english language entry requirements. application documents: 1. cv 2. official transcripts 3. statement of purpose/ statement of research interest optional: 4. letters of recommendation 5. english test score (toefl, ielts, or other tests) 6. publications, awards & honors 7. portfolio and other relevant documents applications should be submitted online by december 31st, 2018. <https://urldefense.proofpoint.com/v2/url?u=http-3a__www.vistec.in.th_admission_form.php&d=dwifaw&c=clk7kqutwtaveovigvi0nu5bouhhpn0h8p7csfnc_gi&r=0w3solp5fswiywf2rl6rss8mcefamfepafdtohgtfyi&m=d-wpnsg6jnuvoalsebenagdplmqqzhgldqrtpvctywu&s=tgysr3qkku-amgiajqfm_h-6ewbdoxqo0kw2e5dksr0&e=>https://urldefense.proofpoint.com/v2/url?u=https-3a__www.vistec.ac.th_admission_form.php&d=dwifaw&c=clk7kqutwtaveovigvi0nu5bouhhpn0h8p7csfnc_gi&r=0w3solp5fswiywf2rl6rss8mcefamfepafdtohgtfyi&m=d-wpnsg6jnuvoalsebenagdplmqqzhgldqrtpvctywu&s=kkjfopk444jzedoxv8ekrswjrt6ab5xngcqwrnwrkom&e= <https://urldefense.proofpoint.com/v2/url?u=http-3a__www.vistec.in.th_admission_&d=dwifaw&c=clk7kqutwtaveovigvi0nu5bouhhpn0h8p7csfnc_gi&r=0w3solp5fswiywf2rl6rss8mcefamfepafdtohgtfyi&m=d-wpnsg6jnuvoalsebenagdplmqqzhgldqrtpvctywu&s=gex7nnephr5napct-k1qvzgm0lxdjp_srrebg7ezvlm&e=>https://urldefense.proofpoint.com/v2/url?u=https-3a__www.vistec.ac.th_admission_&d=dwifaw&c=clk7kqutwtaveovigvi0nu5bouhhpn0h8p7csfnc_gi&r=0w3solp5fswiywf2rl6rss8mcefamfepafdtohgtfyi&m=d-wpnsg6jnuvoalsebenagdplmqqzhgldqrtpvctywu&s=e5ywaacnxcsgjhsszdvonkkaobstak8z-456a7uscu0&e= for further information or questions please contact assoc. prof. dr. sarana nutanong e-mail: <https://urldefense.proofpoint.com/v2/url?u=http-3a__www.tnb.ua.ac.be_mailman_listinfo_comp-2dneuro&d=dwifaw&c=clk7kqutwtaveovigvi0nu5bouhhpn0h8p7csfnc_gi&r=0w3solp5fswiywf2rl6rss8mcefamfepafdtohgtfyi&m=d-wpnsg6jnuvoalsebenagdplmqqzhgldqrtpvctywu&s=rlm7l1tbkr_alinqqnsmosdm20fqu6fuincrnb_v2jm&e=> snutanon at vistec.ac.th vidyasirimedhi institute of science and technology, wangchan valley 555 moo1 payupnai, wangchan, rayong 21210 thailand website of vistec: https://urldefense.proofpoint.com/v2/url?u=https-3a__www.vistec.ac.th&d=dwifaw&c=clk7kqutwtaveovigvi0nu5bouhhpn0h8p7csfnc_gi&r=0w3solp5fswiywf2rl6rss8mcefamfepafdtohgtfyi&m=d-wpnsg6jnuvoalsebenagdplmqqzhgldqrtpvctywu&s=ulbhihoqa07f5sykynrsthlzzxdgbdgqo7gnffxf-g4&e="
3,2019,ph.d. positions at ntnu in taiwan," phd student positions application deadline: 15th july 2019 program start date: 1st september 2019 overview the educational robotics center at national taiwan normal university has openings for three ph.d. students in the areas of intelligent robotics, such as    1.    programming by demonstration    2.    explainable ai for self-driving cars    3.    humanoid robot athletes the positions are funded through full scholarships from national taiwan normal university (ntnu) and the taiwanese ministry for science and technology (most). the scholarship includes a stipend of $40,000 ntd per month. requirements potential candidates must have a strong academic background including successful completion of a thesis-based m.sc. or similar degree at an accredited university. candidates must have demonstrated academic aptitude through previous publications including academic papers,  thesis, or project reports. previous experience in large projects or participation at the federation of international robot sports association <https://urldefense.proofpoint.com/v2/url?u=http-3a__www.firaworldcup.org&d=dwmfaq&c=clk7kqutwtaveovigvi0nu5bouhhpn0h8p7csfnc_gi&r=0w3solp5fswiywf2rl6rss8mcefamfepafdtohgtfyi&m=oztfnn5evegrab9upcdrfi9xamlpkmnxt-2s4hqlwoq&s=nt_tg1zt4oa5qnzwsf6mvtjsrab1mkefkczr52cores&e=> (fira) or robocup <https://urldefense.proofpoint.com/v2/url?u=http-3a__www.robocup.org&d=dwmfaq&c=clk7kqutwtaveovigvi0nu5bouhhpn0h8p7csfnc_gi&r=0w3solp5fswiywf2rl6rss8mcefamfepafdtohgtfyi&m=oztfnn5evegrab9upcdrfi9xamlpkmnxt-2s4hqlwoq&s=a-rbqvdn0tudmszj9y8rlyuvzxguqxd7dyqv7k_0nru&e=> robot competitions is a plus. all candidates must possess strong practical skills in the areas of general programming, especially using ros <https://urldefense.proofpoint.com/v2/url?u=http-3a__www.ros.org&d=dwmfaq&c=clk7kqutwtaveovigvi0nu5bouhhpn0h8p7csfnc_gi&r=0w3solp5fswiywf2rl6rss8mcefamfepafdtohgtfyi&m=oztfnn5evegrab9upcdrfi9xamlpkmnxt-2s4hqlwoq&s=9wjs637bfxjuuwk-y-gugwovjnvrst0uymtm6ejwm80&e=> . educational robotics center the educational robotics center (erc) at ntnu is guided by prof. jacky baltes <https://urldefense.proofpoint.com/v2/url?u=https-3a__scholar.google.com.tw_citations-3fuser-3d557qr3kaaaaj-26hl-3den&d=dwmfaq&c=clk7kqutwtaveovigvi0nu5bouhhpn0h8p7csfnc_gi&r=0w3solp5fswiywf2rl6rss8mcefamfepafdtohgtfyi&m=oztfnn5evegrab9upcdrfi9xamlpkmnxt-2s4hqlwoq&s=0tnjcuq4p7mrtza-yhgpxcgsbm3cejkqfkqvewez9ji&e=>. the research group focuses on the development of robot athletes for various sports. prof. baltes? team is an experienced team and has successfully competed at various robot competitions. the erc is an international research lab, which currently includes about 20 researchers from brazil, canada, germany, india, indonesia, iran, south korea, taiwan, thailand, and   vietnam  . courses and research are conducted in english. the erc maintains collaborations with many other research labs world-wide. national taiwan normal university the national taiwan normal university is one of the best universities in taiwan and has a world class reputation (22nd in qs university world ranking <https://urldefense.proofpoint.com/v2/url?u=http-3a__en.ntnu.edu.tw_news-2dshow.php-3fid-3d11955&d=dwmfaq&c=clk7kqutwtaveovigvi0nu5bouhhpn0h8p7csfnc_gi&r=0w3solp5fswiywf2rl6rss8mcefamfepafdtohgtfyi&m=oztfnn5evegrab9upcdrfi9xamlpkmnxt-2s4hqlwoq&s=8o0igysgrt17w2qsqbmtcrnd2z8juidfbzy7ou2aguu&e=>) in education. it was initially a teachers? college (hence normal university), but has expanded in recent years to be a full university including colleges for science, engineering, arts, and humanities. ntnu has approximately 17,000 students with about 1,800 foreign students. ntnu is also the host of the mandarin chinese teaching center, one of the best schools for learning mandarin chinese. the main campus of ntnu, where erc is located, is in the da?an district of taipei. taiwan. taipei is a modern and vibrant city with great food and an exciting environment that combines asian and western culture. taiwan is also the main manufacturing hub for advanced electronics and includes headquarters of many multinational technology powerhouses such as nvidia, google, microsoft, mediatek, asus, acer, foxconn, garmin, and giant. application procedure to apply for one of these positions or for further information about the erc, please contact prof. jacky baltes via email jacky.baltes at ntnu.edu.tw before the deadline 15th july 2019. --  prof. jacky baltes, skype, twitter, telegram: jacky.baltes national taiwan normal university 162 heping e. rd., sec. 1, taipei 10610, taiwan tel: +886 -2-7734-3634 email: jacky.baltes at ntnu.edu.tw"
4,2019,"fully funded ms/phd student positions  in bio-inspired robotics, neural engineering, computer vision,  and data science at ist, vistec, thailand in-reply-to: <sg2pr06mb22508f5a85c77d92e919fb6da85e0@sg2pr06mb2250.apcprd06.prod.outlook.com> references: <sg2pr06mb22508f5a85c77d92e919fb6da85e0@sg2pr06mb2250.apcprd06.prod.outlook.com>"," dear colleagues, the school of information science and technology (ist) at vidyasirimedhi institute of science and technology (vistec), thailand, welcomes all applicants for our international master?s and doctoral degree program. our school offers a competitive, english language, interdisciplinary, world-class phd training and research program in information science and technology. we have 20 fully-funded master and phd student positions. our program includes 5-years ms+phd and 3-years phd options. the students will be formally affiliated with the msphd/phd program at ist, vistec, thailand. they will have the opportunity to develop new algorithms and research ideas and perform experiments on real hardware, e.g., advanced bio-inspired robotic systems, drone technology, the internet-of-robotic-things (iort), human-machine interaction (e.g., exoskeleton), brain-computer interface systems, computer vision, computer graphics, deep learning, large-scale scientific databases & distributed systems. our basic research under the ist umbrella focuses on main areas: data science, cloud/hpc, iort, bio-inspired robotics, neural engineering, and computer vision. bio-inspired robotics: we address how to develop brain-like mechanisms for adaptive motor control and autonomous learning of embodied multi-sensorimotor robotic systems (i.e., bio-inspired robots, hybrid soft robots, exoskeleton). we also transfer the developed mechanisms (brain technology) to application areas like human-machine interaction, brain-machine interface, and rehabilitation (see www.brain.vistec.ac.th<https://urldefense.proofpoint.com/v2/url?u=http-3a__www.brain.vistec.ac.th_&d=dwif-g&c=clk7kqutwtaveovigvi0nu5bouhhpn0h8p7csfnc_gi&r=0w3solp5fswiywf2rl6rss8mcefamfepafdtohgtfyi&m=w8n4h9tapmolv1q0uviid0d4xs1n8qaau0ou8nq6gvk&s=wmxa7cvr0pznpmc3gcfiwvleu0rsgiubbszkrj5vmlm&e= > for more details). neural engineering: we address an investigation of closed-loop eeg-based brain-computer interface (bci) that helps bridge the gap in communication between man and machine. understanding patterns of brain activity from basic neuroscience research will help engineering to optimize the bci system that could be applied in the real-world environment. advanced signal processing techniques and pattern recognition methods such as machine learning, artificial neural network, and deep learning can improve the efficiency of bci by increasing information transfer rate and accuracy. ultimately, research-based on bci could lead to the development of novel tools used in both clinical and healthy populations (see www.brain.vistec.ac.th<https://urldefense.proofpoint.com/v2/url?u=http-3a__www.brain.vistec.ac.th_&d=dwif-g&c=clk7kqutwtaveovigvi0nu5bouhhpn0h8p7csfnc_gi&r=0w3solp5fswiywf2rl6rss8mcefamfepafdtohgtfyi&m=w8n4h9tapmolv1q0uviid0d4xs1n8qaau0ou8nq6gvk&s=wmxa7cvr0pznpmc3gcfiwvleu0rsgiubbszkrj5vmlm&e= > for more details). computer vision and learning: our research interests are at the intersection of computer vision, deep learning, and computer graphics. his past work includes 3d face reconstruction from internet photos and realistic video speech synthesis. his goal is to bring computer vision out of the lab and into the real world. data science and engineering (large-scale analytics, data engineering, data mining, artificial intelligence, and machine learning): we address various scalability issues in machine learning, data mining, database query processing. we are especially interested in developing solutions for machine learning problems with an extremely large number of classes and a scalable system for managing and storing various forms of high-dimensional data. our application domains include (but not limited to) natural language processing, time-series data management, geospatial data mining, business intelligence, iot data analytics, and health data analytics. financial support: this studentship includes 1) fee bursary to cover the tuition fee rate 2) a maintenance allowance during the study, 3) grant of 1 million bath scholarship for international research experience. person specification: the successful applicant from any nationality will have a strong undergraduate (first class or upper second class) and/or master?s degree in ? science (physics, mathematics, computer and related fields) ? engineering (robotics, computer, mechanical, electrical and related fields) ? applied science (information technology, ict and related fields) applicants with excellent programming and analytical/mathematical skills as well as expertise and research interests in the intersection of data science, bio-inspired robotics, neural engineering, and computer vision are particularly welcome to apply. applicants from non-english speaking countries will need to satisfy english language entry requirements. application documents: 1. cv 2. official transcripts 3. statement of purpose/ statement of research interest optional: 4. letters of recommendation 5. english test score (toefl, ielts, or other tests) 6. publications, awards & honors 7. portfolio and other relevant documents applications should be submitted online by january 15th, 2020. <https://urldefense.proofpoint.com/v2/url?u=http-3a__www.vistec.in.th_admission_form.php&d=dwif-g&c=clk7kqutwtaveovigvi0nu5bouhhpn0h8p7csfnc_gi&r=0w3solp5fswiywf2rl6rss8mcefamfepafdtohgtfyi&m=w8n4h9tapmolv1q0uviid0d4xs1n8qaau0ou8nq6gvk&s=sjfnahzfj2ghguuzhee3jx-rn1liyg6d8ombat9numw&e= > https://urldefense.proofpoint.com/v2/url?u=https-3a__www.vistec.ac.th_admission_&d=dwif-g&c=clk7kqutwtaveovigvi0nu5bouhhpn0h8p7csfnc_gi&r=0w3solp5fswiywf2rl6rss8mcefamfepafdtohgtfyi&m=w8n4h9tapmolv1q0uviid0d4xs1n8qaau0ou8nq6gvk&s=fxnp-ljvu1wnpgzchh5hweykruk_cocotkx6igktsb4&e=  for further information or questions please contact: assoc. prof. dr. sarana nutanong e-mail: snutanon at vistec.ac.th vidyasirimedhi institute of science and technology, wangchan valley 555 moo1 payupnai, wangchan, rayong 21210 thailand tel: +6633-01-4116"
