,year,subject,content
64,2014,"four postdoc positions available at the  center for applied autonomous sensor systems,  sweden "," ======================================================================              ***** four postdoc positions available *****           center for applied autonomous sensor systems (aass)                       ?rebro university,  sweden  ====================================================================== ---------------------------------------------------------------------- in short ---------------------------------------------------------------------- applications are invited for four postdoc positions at ?rebro university,  sweden .  all positions are funded by the national project ""semantic robots"". we seek applicants in one or more of the following areas: -- long term 3d mapping and localization -- vision based mapping and localization -- semantic perception and semantic object perception ---------------------------------------------------------------------- about the semantic robots project ---------------------------------------------------------------------- the overall aim of the project is to develop semantic robots, that is, robots which use multi-semantic models of their environment, tailored to their action and perception capabilities, in order to automatically derive and execute action plans that achieve given goals. the project will integrate research in robotics and artificial intelligence to address closely related topics, namely, semantics-based perception, 3d world modelling and planning for long-term operation in dynamic environments. semantic perception provides human-like meaning to the information a robot acquires about its environment: it derives symbolic representations from sensor data and uses them for reasoning.  models of the robot's environment should go beyond current 3d metric and topological maps, as they should be able to store and maintain more than just geometric information over long periods of time. the information extracted from the models could then be used for planning at different levels of abstraction, from task planning to fleet motion coordination. the semantic robots project involves ?rebro university as the academic partner and a number of swedish industrial partners, including volvo construction equipment, atlascopco and kollmorgen automation. the overall aim is twofold: to advance the state of the art in key areas of robotics and artificial intelligence, and to demonstrate the results obtained in industrially relevant settings. ---------------------------------------------------------------------- about the positions ---------------------------------------------------------------------- the successful candidate will be employed as a postdoc with ?rebro university for an expected duration of 2 years. the main task of the postdocs will be to perform world-class research on one or more of the areas below. background/expertise in combinations of these areas is a plus. -- long term 3d mapping and localization in large scale dynamic environments the research in this area will focus on building consistent 3d maps of large environments. this involves working with cutting edge 3d scanning technology applied to autonomous industrial vehicles operating in real-world settings. more specifically, the work will address the development of new algorithms to deal with varying scales of dynamics in the environment, so as to maintain accurate models over long periods of time. in addition, research in this area will also focus on extracting and maintaining relevant semantic information (e.g., terrain classification, lane extraction, traffic flow information) from the model of the environment. the work will be carried out in close cooperation with several industrial partners, over different application scenarios.  additional opportunities for work on computer vision based methods and camera based modelling and localization are also within the scope of this area. the successful candidate will have prior experience in mapping, slam and 3d scan registration. experience with vision-based mapping and localization is a plus. -- vision based mapping and localization in natural environments the work in this area will focus on using and developing novel camera techniques for mapping and localization in large, real-world environments, ranging from large gardens to indoor warehouses. research in this area will concentrate on using machine learning and data mining techniques for developing new ways of representing additional semantic information into maps. for instance, part of the effort will be to include into maps information about different types of vegetation in outdoor environments and loading/storage areas or pedestrian crossings within warehouses. also, the work will encompass camera based modeling, detection and tracking of people. although the main focus of this area lies with using camera-based sensors, it will be possible to work also with other sensor modalities, such as lidar, laser or rgbd. the work in this area will be carried out in close cooperation with several industrial partners.  the successful candidate will have prior experience in the areas of machine learning, computer vision and mapping. -- semantic perception semantic perception is a central component to enable higher level reasoning and planning in robotic systems. an important part of semantic perception involves naming objects and measured phenomena in the environment and understanding the relations between them. this also entails providing an intuitive description of the environment in term of semantics that can be effectively shared with human users. the successful candidate will have experience in semantic perception for robotics involving both multi-modal perception, and applications in indoor and outdoor environments. the candidate is expected to hold a phd degree in the domain of machine learning, computer vision, or robotics. excellent skills in software development are required. experience with working with industry is a plus. successful candidates will work in close cooperation with a core group of senior researchers and phd students at aass who specialize in knowledge representation and reasoning, perception and mapping and planning for robots.  the results obtained within the scope of semantic robots are expected to be demonstrated outside lab test conditions in industrially-relevant scenarios and to be published in top-ranking conferences and journals. a small amount of teaching may also be part of the postdoc's duties. ---------------------------------------------------------------------- prerequisites and application process ---------------------------------------------------------------------- in addition to a clear interest, the successful applicant must have a solid theoretical background and working experience in one or more of the above research topics. a phd degree in computer science, robotics or comparable field is required, as well as a strong publication record in relevant topics. knowledge of the swedish language is not required, but proficiency in both written and spoken english is mandatory. to apply for a position, please send to <sr-recruitment at aass.oru.se>: + a motivation letter + an updated cv (including at least two references) + copies of 2/3 most relevant publications + copy of phd thesis (if available) + an updated publication list (and, preferably, a link to the applicant's google scholar profile) applications can be sent immediately, and they will be accepted until the positions are filled.  we are looking forward to receiving your application! ---------------------------------------------------------------------- about the place ---------------------------------------------------------------------- ?rebro university (www.oru.se) is a young university which currently enrolls more than 15,000 students.  it is located in ?rebro, a city of 130,000 inhabitants situated in central  sweden . the center for applied autonomous sensor systems (aass) is one of the strong research environments at ?rebro university.  it carries out multi-disciplinary research at the intersection of robotics, machine learning, artificial intelligence, computer vision, computer science, and measurement technology. the research and human environment at aass is young and enthusiastic. researchers come from a dozen different countries, in europe and worldwide, and have different scientific and cultural backgrounds.  aass also frequently hosts international researchers and is involved in several international projects. aass is internationally renowned for its research in mobile robotics, cognitive robotic systems, robot ecologies, and artificial olfaction. further information can be found at www.aass.oru.se/research/robots/ and www.aass.oru.se/research/learning/. --  marcello cirillo , ph.d. aass research center department of technology, ?rebro university ( sweden ) http://aass.oru.se/research/learning/moco.html email: marcello.cirillo at aass.oru.se"
65,2015,"research fellow possiitons in robotic  exoskeletons,  sweden "," university of g?vle,  sweden  is looking for 2 experienced researchers to contribute to ongoing research and teaching activities in the area of robotics and automation. the work focuses on detailed technical and associated support for the current and planned activities to develop physical assistance exoskeletons for elderly and disabled persons to perform normal daily living activities. candidates for appointment at post-doctoral research level are expected to have a doctoral degree in an area such as electrical engineering, mechanical engineering or applied computer science with sufficient specialist experience in robot systems design and development. persons without a doctoral degree may apply but must have suitable research experience to be eligible for consideration for appointment at research fellow level. candidate must have deep and extensive experience of working in the areas of control and robotics (hardware and software aspects), electronics, mechanism design and embedded systems as well as having experience of modelling and simulation, human biomechanics, real time control systems and controller design. for application details see the following link: http://www.hig.se/4.5fc1b6fa12929ea9b0480009887.html?guid=fe08235b-72e4-4598-a188-1951e429cfeb deadl?ne: 20 feb 2015. -------------------------------------------------------------------------------------------------------------------- professor gurvinder s. virk professor of robotics and the built environment, university of g?vle, se-801 76 g?vle,  sweden  professor of robotics & autonomous systems, kth royal inst of tech, se-100 44 stockholm tel: +46 26 648704, fax: +46 26 648758, mob: +46 705 406425, email: gurvinder.virk at hig.se [h?gskolan i g?vle] h?gskolan i g?vle, 801 76 g?vle * 026 64 85 00 * www.hig.se<http://www.hig.se> f?r en h?llbar livsmilj? f?r m?nniskan university of g?vle, se-801 76 g?vle,  sweden  * +46 (0) 26 64 85 00 * www.hig.se<http://www.hig.se>"
66,2015,phd student position in formal  methods-based planning (kth)," phd student position in formal methods-based planning at royal institute of technology (kth) the automatic control deparment at kth invites applications for a ph.d. position in formal methods-based planning. the successful candidate will join a research group that is focusing on new design methodologies for automated planning and control synthesis under complex system specifications. applications of the research include, but are not limited to autonomous robot action and motion planning, or multi-agent systems control and coordination. kth offers an attractive working environment, generous remuneration, as well as other employment benefits. as a phd student at kth you have many opportunities to participate at conferences, projects and other relevant events which will extend your professional network and benefit your future career. the successful applicant is expected to hold or to be about to receive an m.sc. degree in one of the following or related disciplines: computer science, computer engineering, applied mathematics, or similar, preferably with a focus in formal methods for verification or synthesis, and/or artificial intelligence. he or she should have an outstanding academic track record, and well developed analytical and problem solving skills. we are looking for a strongly motivated person, who is able to work independently. good command of english orally and in writing is required to publish and present results at international conferences and in international journals. the evaluation will be based on how well the applicant fulfills the above qualifications. for further information, please see:  https://www.kth.se/en/om/work-at-kth/lediga-jobb/what:job/jobid:63167/where:4/ <https://www.kth.se/en/om/work-at-kth/lediga-jobb/what:job/jobid:63167/where:4/>   contact: associate prof. dimos dimarogonas, dimos at kth.se,  http://people.kth.se/~dimos/ <http://people.kth.se/~dimos/>  , dr. jana tumova, tumova at kth.se,  http://people.kth.se/~tumova/ <http://people.kth.se/~tumova/>   -- view this message in context: http://robotics-worldwide.1046236.n5.nabble.com/robotics-worldwide-jobs-phd-student-position-in-formal-methods-based-planning-kth-tp5711329.html sent from the robotics-worldwide mailing list archive at nabble.com."
67,2015,postdoc position in multi-robot systems 	at kth," a postdoc position in multi-robot control is available at kth. the full announcement and all details on the requirements for this position can be found here: https://www.kth.se/en/om/work-at-kth/lediga-jobb/what:job/jobid:64995/where:4/ deadline for applications is set to june 12, 2015. for any further required information, please contact assoc. prof. dimos dimarogonas, dimos at kth.se<mailto:dimos at kth.se>, http://people.kth.se/~dimos/."
68,2015,"internship in assistive robotics at 	karlstad university,  sweden "," internship in assistive robotics at karlstad university,  sweden    the physically and cognitive embodied robotics and intelligent machines (picorobota) group at karlstad university  (http://www.kau.se/en/elektroteknik/robotics) in  sweden  has two open internship for a project on the development  of a human-friendly assistive robot vehicle for supporting physically elderly and assisting care givers for the ambient assisted living.  for this purpose, two assistive robots vehicles currently under development will be improved and integrated into a single platform:  an intelligent carrying-medical tools robot vehicle and a human-friendly assistive robot vehicle for supporting physically elderly.   the two internship positions from august to december 2015 will be focused on:   ? control and variable stiffness mechanism design of a human-friendly walking assist robot vehicle?   ? navigation control and 3d gesture recognition of an intelligent carrying-medical tool assistant robot?   fruitful internships may lead to a phd or post-doc positions with our university partners in japan, italy or poland.   previous experience in robotics control, human-robot interaction, and mechanical design is welcome. candidates should have programming experience in c and c++. familiarity with the control engineering, signal processing and artificial intelligent techniques is a strong plus.   successful applicants will be financially supported in terms of accommodation and air flight ticket (within eu). karlstad university offers a basic insurance in case of emergency (during the so-called working hours associated with work at university),  called the swedish state?s group insurance and personal insurance (gif).   for more information, please contact associate professor jorge solis (jorge.solis at kau.se).  interested candidates should submit a letter of motivation and a detailed cv, specifying the preferred topic, a list of references. application deadline: july 3rd, 2015.     jorge solis, ph.d.  associate professor  faculty of health, science and technology department of engineering and physics karlstad,  sweden  email:  <mailto:jorge.solis at kau.se url> jorge.solis at kau.se   url: http://www.kau.se/en/avdelningen-for-fysik-och-elektroteknik/ee/staff/solis <http://www.kau.se/en/avdelningen-for-fysik-och-elektroteknik/ee/staff/solis >  lab-url: http://www.kau.se/en/elektroteknik/picorobota     "
69,2015,phd position: constrained robotic  manipulation in human-centered environments," [phd position: constrained robotic manipulation in human-centered environments] we invite applications for one doctoral student position in robot control and manipulation for human-centered environments and physical human robot interaction (phri). the doctoral student will work in the areas of robotics and automatic control emphasizing in robotic manipulation and adaptive control techniques. the position is with the mechatronics research group in the division of automatic control, automation and mechatronics, department of signals and systems, chalmers university of technology, gothenburg,  sweden .  for more information about the department please follow the link:  www.chalmers.se/en/departments/s2<http://www.chalmers.se/en/departments/s2>. [application deadline:] 15-08-2015 [how to apply:] the application procedure is described in the following link: https://web103.reachmee.com/ext/i003/304/job?site=5&lang=uk&validator=a72aeedd63ec10de71e46f8d91d0d57c&job_id=3208 [contact:] assistant professor yiannis karayiannidis, e-mail: yiannis at chalmers.se<mailto:yiannis at chalmers.se> professor jonas sj?berg, e-mail: jonas.sjoberg at chalmers.se<mailto:jonas.sjoberg at chalmers.se> [description:] modern robotic applications require the design of human-friendly robots that are able to operate in environments designed for human inhabitants (human-centered environments) and to collaborate with possibly inexperienced human operators. typical tasks involved in such applications are handing over an object to the robot and human-robot cooperative manipulation of a jointly held object. the high amount of uncertainty mainly related to the involvement of the human (e.g. the human imposes constraints that are unknown to the robot) can deteriorate the performance of the robot. you are expected to design and test systems for robot control and estimation in order to enable a robot to perform constrained manipulation tasks in human-centered environments that may involve interaction with other dynamic agents (humans or robots) under uncertainties. [major responsibilities:] the phd student will carry out original research and complete coursework throughout the period of appointment. results will be communicated in the form of scientific articles, conference presentations, etc. and the phd thesis. the candidate will work under the supervision of senior researchers with background in robotics, automatic control and optimization with the division of automatic control, automation and mechatronics. there will also be opportunities for collaboration with the center for autonomous systems at royal institute of technology (kth). the working time of a phd student is mainly devoted to research. undergraduate teaching duties, not exceeding 20% of the working time, may include supervision of msc students. [position summary:] full-time temporary employment. the position is limited to a maximum of five years. [qualifications:] applicants should have a master's degree (or diploma) in automation and mechatronics or electrical engineering or mechanical engineering or applied math, or an equivalent or similar background. basic knowledge about control systems and robotics as well as experience in simulation of dynamical systems are required. furthermore, the position requires sound verbal and written communication skills in english. high grades in relevant undergraduate courses, c/c++ and hardware implementation experience are advantageous. ------------------------------------------------------------------------------------- yiannis karayiannidis, phd + assistant professor    automatic control, automation and mechatronics    department of  signal and systems    chalmers university of technology    se-412 96 g?teborg,  sweden  + researcher     center of autonomous systems     school of computer science and communication     royal institue of technology, kth     se- 100 44 stockholm,  sweden  phone:   +46(0)31 772 1562  (chalmers)               +46(0)8 790 6734 (kth)               +46(0)729209806 (cell) e-mail: yiannis at chalmers.se<mailto:yiannis at chalmers.se>; yiankar at kth.se<mailto:yiankar at kth.se>"
70,2015,phd or post-doc robot learning 	positions at inria bordeaux in-reply-to: <1868445647.11734658.1439894287638.javamail.zimbra@inria.fr>," to all interested, we are seeking applications for phd students (3years) and/or postdocs (2.5years) in the area of artificial intelligence and robot learning at inria. our interests are in developing machines that are able to learn novel skills and capable of natural and robust interaction with people. we focus our research on intelligent exploration techniques, robot learning and automatic learning of representation for artificial intelligence. one position is open to work in an international research project (with partners from canada,  sweden ,  spain , belgium and france). the candidates will be involved in research in the areas of deep learning of action and state representations, and interactive machine learning. the candidates must have strong mathematical competences, experience in machine learning and programming proficiency (e.g. c/c++, matlab, python or java). knowledge of deep learning and/or experience with real robots is a plus. inria is a highly reputed french national center for computer science and automation. it has more than 3000 researchers and is distributed among 8 centers. these positions are for the flowers team at inria bordeaux sud-ouest and will involve travelling for collaborating with the project partners. bordeaux is a growing city with a wonderful natural landscape, a very active city life and with a booming economy. is has a very privileged location: 3h from paris, 2h from toulose, 30 minutes from the sea and 2hours from the pyreness mountains. it has very good travel connections with fast trains and international flights including low-cost companies.  interested candidates should send a detailed cv, and email addresses of three references to manuel lopes at manuel.lopes at inria.fr .  review of applications will continue until the position is filled. desired starting date is 1 of november 2015. http://flowers.inria.fr  http://3rdhandrobot.eu/ http://www.inria.fr  http://www.bordeaux.fr/  ---------------------------------------------------------------  manuel lopes - researcher flowers.inria.fr/mlopes  flowers team phone: +33524574179  inria bordeaux sud-ouest, bat. a29  351 cours de la lib?ration  33405 talence, cedex, france  --------------------------------------------------------------- "
