,year,subject,content
116,2017,"ph.d. studentship in  assistive robotics (thapar university,  patiala india and ugav  sweden ) deadline is june 30, 2017"," *ph.d. studentship in assistive robotics* applications are invited for two fully-funded phd studentships at the department of mechanical engineering, thapar university, patiala, india. this is a part of a collaborative work between university of g?vle (ugav), g?vle,  sweden  and thapar university, patiala. the title of the phd project is *?developmental of a lower-body exoskeleton to provide partial assistance to elderly persons?*. since jan, 2015, university of g?vle ( sweden ) and thapar university (india) are collaboratively thriving in this direction of realizing this affordable solution for healthy elderly. the university of g?vle has been actively involved in the research and development of assistive exoskeletons for elderly persons and currently has various running projects (exo-legs, axo-suit and saath) with over ?1m external funding. the technology being realized is receiving significant attention globally but issues of cost and reach to mass markets are still unresolved. these issues seem to be particularly relevant to emerging mass markets in india and hence the current proposal seeks to initiate collaborations with colleagues in india to explore alternatives as to how the assistive exoskeletons can be realized more affordably in  sweden  as well. the aim of this collaborative research work is to extend the current research at g?vle in physical assistant exoskeletons. the students will be registered at the department of mechanical engineering, thapar university, patiala, india and can spend three months per year in ugav,  sweden . the student will be jointly supervised by dr. ashish singla (tu, patiala), and dr sajid rafique from ugav,  sweden . *funding* the students will be entitled for institute scholarship (3 lacs inr per annum + other academic allowances) for 3 years, provided he gets through the formal admission process (online test and interview) at tu (last date to apply is 30th june), patiala. more information on phd  admission can be found at https://urldefense.proofpoint.com/v2/url?u=http-3a__thapar.edu_index.php_achievers_mechanical-2dengineering&d=dwifaq&c=clk7kqutwtaveovigvi0nu5bouhhpn0h8p7csfnc_gi&r=0w3solp5fswiywf2rl6rss8mcefamfepafdtohgtfyi&m=wj9l5gl2torqd8haxtkg_1px_wdjiltz7erw-udw5mc&s=rkqsugdn1ufn9x6sxav0hkcsr_zrsdy55vb1fa0i9yk&e=  -department/ph-d-academic-regulations. from the ongoing collaborative work, funding of 30,000 sek will be provided to support accommodation, living and local travel cost for three months per year in ugav,  sweden . moreover, 50,000 sek per year will be reserved to meet the equipment, hardware and other misc. costs. *eligibility* applicants must have a masters degree in robotics, mechatronics, design, automation, cad/cam, mechanisms, electronics/electric engineering or any related discipline. good programming skills and thorough knowledge of a cad software (solidworks/pro-e/ideas/inventor etc.) is an essential requirement. applicants with advanced knowledge of robotics and mechanism design are particularly encouraged to apply. the working language of tu and ugav is english, so good written and oral communication skills are also required. *application: *        deadline: 30 june 2017         duration: 3 years (full time) - extension possible         expected starting date: august, 2017         place: tu, patiala, india to request further information and to apply, send an email to the undersigned. please support your application (cv) with a statement of interest, the name and contact of two references and any other supporting documents you may consider helpful. --  with regards, ashish -- *dr. ashish singla* phd - indian institute of technology, kanpur former visiting researcher at university of g?vle,  sweden  *assistant professor* department of mechanical engineering thapar university patiala - 147004 (punjab) office - bc-103 email id : ashish.singla at thapar.edu <ashishsingla09 at gmail.com> phone: +91-175-2393132 <0175%20239%203132> (o), 3961 (r) mobile : +91-8427950635 <084279%2050635> rg profile: https://urldefense.proofpoint.com/v2/url?u=https-3a__www.researchgate.net_profile_ashish-5fsingla4-3fev-3dhdr-5fxprf&d=dwifaq&c=clk7kqutwtaveovigvi0nu5bouhhpn0h8p7csfnc_gi&r=0w3solp5fswiywf2rl6rss8mcefamfepafdtohgtfyi&m=wj9l5gl2torqd8haxtkg_1px_wdjiltz7erw-udw5mc&s=ha6sxfku87wotbtwfgsbnc5w0rwjccgwxshrkemcj80&e= "
117,2017,postdoctoral position in computer  vision and machine learning," link?ping university hereby announces a postdoc position in computer vision at the department of electrical engineering, link?ping university. the link?ping computer vision lab is a vibrant research environment with five faculty members, one postdoc, 11 phd students, and several affiliated researchers. https://urldefense.proofpoint.com/v2/url?u=http-3a__www.cvl.isy.liu.se&d=dwigaq&c=clk7kqutwtaveovigvi0nu5bouhhpn0h8p7csfnc_gi&r=0w3solp5fswiywf2rl6rss8mcefamfepafdtohgtfyi&m=ypkqrokst1agzvfocgwvgbacialholnmcb1lt1r4cy0&s=oiee53rsqxzkvdudxqs33uvzooauayghvlk2jgo4rq4&e=  work description the postdoc will work as a researcher in a project on machine learning for time of flight cameras, and features collaboration between the computer vision lab and the company fotonic. 3d cameras using the time of flight (tof) principle are increasingly popular for automation and robotics. many new consumer products such as the kinect v2, and the microsoft hololens device also rely on tof for 3d mapping. we will together with fotonic study the fundamentals of the measurement problem, and temporal fusion techniques, with the aim of improving depth map quality, range, and robustness. the postdoc is expected to publish papers at high ranking venues such as eccv, cvpr, iccv and 3dv. appointment time a postdoc is appointed until further notice, but for no longer than two years. the appointment can be renewed if there are special reasons. starting date by agreement. salary the university applies individual salary scales adapted to the experience of the employee and to the labour market. qualifications the applicant should have a doctorate in computer vision or machine learning, or an equivalent degree from a foreign university. the doctorate shall have been obtained no longer than three years before the expiration date of the application. earlier publications in first class journals and highly-competitive conferences in areas relevant to the work is considered a merit. applicants with a rigorous background in mathematics, signal processing, gpu programming, and machine learning will be prioritized. prior experience with lidar or tof cameras is beneficial.  inquiries further details on the position can be provided on request by associate professor per-erik forssen (per-erik.forssen at liu.se) who is also the project manager, or by professor michael felsberg (michael.felsberg at liu.se) who is heading the lab. applying apply by following the instructions at the following link: https://urldefense.proofpoint.com/v2/url?u=https-3a__old.liu.se_jobba_lediga-2djobb-3fl-3den-26sc-3dtrue&d=dwigaq&c=clk7kqutwtaveovigvi0nu5bouhhpn0h8p7csfnc_gi&r=0w3solp5fswiywf2rl6rss8mcefamfepafdtohgtfyi&m=ypkqrokst1agzvfocgwvgbacialholnmcb1lt1r4cy0&s=udesgstsxsyydalg72fexkd9jgb4q6knk2gqtzwgqyk&e=  your application must be received at latest 2017-09-08, september 8. --  per-erik forss?n                         | docent and associate professor computer vision lab                  | https://urldefense.proofpoint.com/v2/url?u=http-3a__users.isy.liu.se_cvl_perfo_&d=dwigaq&c=clk7kqutwtaveovigvi0nu5bouhhpn0h8p7csfnc_gi&r=0w3solp5fswiywf2rl6rss8mcefamfepafdtohgtfyi&m=ypkqrokst1agzvfocgwvgbacialholnmcb1lt1r4cy0&s=dewo7f1j9hr4rh1gnvkir9k9vswe0s85wova1yvloxk&e=  dept of electrical engineering    | email: perfo at isy.liu.se se-581 83 link?ping                  | phone: +46 (13) 28 5654  sweden                                        | skype: per-erik_forssen"
118,2017,phd position in emotions and human  motion (yael edan)," ph.d. position in emotions and human motion department of industrial engineering and management agricultural, biological, cognitive robotics initiative ben-gurion university of the negev, israel research topic: effects of people?s emotional state on their body motion this research project aims to examine the effects of people?s emotional state on their body motion. based on data generated in lab experiments using a motion capture system, we will investigate the relation between people's emotional state and their body motion and will develop models and algorithms for emotion recognition based on human motion. such models may be used to develop robots that express emotion in their motion and/or devices that can recognize people?s emotional state by monitoring their motions. the project combines data acquisition of motion data, theoretical work, and implementation work. this is an interdisciplinary project conducted in collaboration with researchers from engineering and from behavioral sciences. the research team is led by dr. raziel riemer who specializes in biomechanics research and dr. hila riemer who specializes in research on emotions across cultures. requirements the applicant for this position must have completed an m.sc. or m.a. thesis in engineering, computer sciences, psychology, biomechanics, or cognitive sciences. the applicant must be skilled in both oral and written communication in english, can work independently as well as in collaboration with others. we are looking for candidates with strong technical and programming skills. experience in traditional biomechanics and motor control research techniques, such as motion capture, force measurement, electromyography, programming (matlab/c++/python), and statistics are merits. candidates should have interest in understanding human behavior (although should not necessarily have background in such topics) and be passionate about learning and developing knowledge in a novel and exciting area. ben-gurion university of the negev ben-gurion university (bgu) is an internationally recognized research university that attracts outstanding faculty and researchers from around the world with over 19,000 students. advance innovative multidisciplinary robotics research at bgu is conducted under the auspices of the abc robotics initiative (www.bgu.ac.il/abc-robotics<https://urldefense.proofpoint.com/v2/url?u=http-3a__www.bgu.ac.il_abc-2drobotics&d=dwigaq&c=clk7kqutwtaveovigvi0nu5bouhhpn0h8p7csfnc_gi&r=0w3solp5fswiywf2rl6rss8mcefamfepafdtohgtfyi&m=zjvfv5fjuhm6gxx9kegv1dh0dig1bwt-ovnzjmxtxuk&s=kuoov2zrlb6u4sorjfm9bmjm1s4dg8ebgycsj_d-lzk&e= >). socrates the recruitment is done as part of socrates (social cognitive robotic agents in the european society), a new marie sk?odowska-curie european training network (etn) comprising 7 universities/research institutes: ume? university and ?rebro university in  sweden , universit?t hamburg and fraunhofer ipa, stuttgart in germany, csic barcelona in  spain , university west of england, and ben-gurion university of the negev in israel. additional non-academic partners are: pal robotics, adele robots, alfred nobel science park, urquhart-dykes & lord llp, center for digital innovation, uminova, asea brown boveri, s.a, and fundaci? ace. about the position the research will be conducted at bgu (israel) with some training in germany (universit?t hamburg and fraunhofer ipa, stuttgart in germany). the successful applicant will devote full time for research and will receive a competitive salary for a period of three years, provided that expected study and research results are achieved. no teaching is expected. the salary will be based on the standard marie sk?odowska-curie early-stage researcher living and mobility allowances. expected starting date is september 2017, or as soon as possible after this date. once approved by bgu?s socrates graduate committee, the student must be accepted to bgu?s graduate school (https://urldefense.proofpoint.com/v2/url?u=http-3a__in.bgu.ac.il_en_kreitman-5fschool_pages_admission.aspx&d=dwigaq&c=clk7kqutwtaveovigvi0nu5bouhhpn0h8p7csfnc_gi&r=0w3solp5fswiywf2rl6rss8mcefamfepafdtohgtfyi&m=zjvfv5fjuhm6gxx9kegv1dh0dig1bwt-ovnzjmxtxuk&s=wj4kh1nh1qju-ksw89unqqgvoq_erecx77pam3zgtgs&e= ) and obtain a visa and working permit according to the ministry of interior requirements. the candidate must submit a research proposal and go through a qualification exam within one year of studies on his/her research proposal. to promote mobility, the following rule applies: at the time of recruitment, the applicants must not have resided or carried out their main activity in israel for more than 12 months during the last 3 years. compulsory national service, work in international organizations, and short stays such as holidays are not taken into account. the applicants must not, at the time of recruitment, have spent more than 4 years doing research, and must not have been awarded a doctoral degree. application a complete application should contain the following documents: ? a cover letter including a description of your research interests, your goals in applying for the position (how would this position fit with your goals), and your contact information. ? a curriculum vitae. ? copies of degree certificates, including documentation of completed academic courses and obtained grades. ? copy of completed msc or ma thesis and other original research publications. ? contact information of three people willing to serve as references (including your msc/ma thesis advisor). ? documentation of programming skills and software development experience. applications should be submitted electronically by email no later than august 1, 2017, to the following address: socrates at post.bgu.ac.il<mailto:socrates at post.bgu.ac.il>. for more information about the project and position please contact socrates at post.bgu.ac.il<mailto:socrates at post.bgu.ac.il> www.socrates-project.eu<https://urldefense.proofpoint.com/v2/url?u=http-3a__www.socrates-2dproject.eu&d=dwigaq&c=clk7kqutwtaveovigvi0nu5bouhhpn0h8p7csfnc_gi&r=0w3solp5fswiywf2rl6rss8mcefamfepafdtohgtfyi&m=zjvfv5fjuhm6gxx9kegv1dh0dig1bwt-ovnzjmxtxuk&s=jotxlmeaboxdj1fu3bareznvlsqhs9tqht83ndc1vqw&e= > www.bgu.ac.il<https://urldefense.proofpoint.com/v2/url?u=http-3a__www.bgu.ac.il&d=dwigaq&c=clk7kqutwtaveovigvi0nu5bouhhpn0h8p7csfnc_gi&r=0w3solp5fswiywf2rl6rss8mcefamfepafdtohgtfyi&m=zjvfv5fjuhm6gxx9kegv1dh0dig1bwt-ovnzjmxtxuk&s=jwwn2u68qgxu6bqsk3p_tznah6vfqlchim0xdsimvpu&e= > www.bgu.ac.il/abc-robotics<https://urldefense.proofpoint.com/v2/url?u=http-3a__www.bgu.ac.il_abc-2drobotics&d=dwigaq&c=clk7kqutwtaveovigvi0nu5bouhhpn0h8p7csfnc_gi&r=0w3solp5fswiywf2rl6rss8mcefamfepafdtohgtfyi&m=zjvfv5fjuhm6gxx9kegv1dh0dig1bwt-ovnzjmxtxuk&s=kuoov2zrlb6u4sorjfm9bmjm1s4dg8ebgycsj_d-lzk&e= > https://urldefense.proofpoint.com/v2/url?u=http-3a__www.bgu.ac.il_-7erriemer_&d=dwigaq&c=clk7kqutwtaveovigvi0nu5bouhhpn0h8p7csfnc_gi&r=0w3solp5fswiywf2rl6rss8mcefamfepafdtohgtfyi&m=zjvfv5fjuhm6gxx9kegv1dh0dig1bwt-ovnzjmxtxuk&s=6uh6aa6fa8sgd8sy52ldd6xht3sqtotof-wouyqlhmy&e=  applications will be accepted until the position is filled"
119,2017,phd position in 3d perception and  object recognition," phd position in 3d perception and object recognition center for applied autonomous sensor systems (aass) ?rebro university,  sweden   ------------------------------------------------------------------------------------ summary: the center for applied autonomous sensor systems (aass) at ?rebro university,  sweden  is looking to employ a phd student in computer science, with a focus on 3d perception for mobile manipulation robots. the phd position is coupled to a 4 year work contract with an internationally competitive salary and full social security benefits. we offer you the opportunity to work on cutting-edge research problems alongside an ambitious international research team. in return, we are looking for a dynamic candidate with keen interests in 3d vision, machine learning, and robot programming. about the position: the phd student will focus on the design, implementation, and evaluation of systems for automatic object perception through depth and color camera measurements. the student will be involved in the collaborative eu project iliad, wherein his/her duties will be the practical implementation and evaluation of object detection algorithms. in addition, the research scope of this position will include 3d workspace modeling, object and feature learning, as well as integration between object detection and autonomous manipulation algorithms.  requirements: * a completed masters degree (msc) in computer science, control theory, robotics, or a related discipline. * solid theoretical background of the basic concepts in robotics, computer vision, and perception. * prior experience in registration, mapping, or object detection / recognition is a strong advantage. * excellent programming skills and knowledge of c++ and ros are desirable. about the work environment: the center for applied autonomous sensor systems (aass), located in the city of ?rebro in central  sweden , carries out multi-disciplinary research at the intersection of robotics, machine learning, artificial intelligence, computer vision, computer science, and measurement technology.  aass is internationally renowned for its research in mobile robotics, cognitive robotic systems, robot ecologies, and artificial olfaction. further information can be found at https://urldefense.proofpoint.com/v2/url?u=https-3a__www.oru.se_aass&d=dwifaw&c=clk7kqutwtaveovigvi0nu5bouhhpn0h8p7csfnc_gi&r=0w3solp5fswiywf2rl6rss8mcefamfepafdtohgtfyi&m=rl8hzbmngi0wmbu3bzec2g7cezck2kgw4jq2ti8pbqi&s=1zcxy1m3emlctwubgmdwaoyjnio0z6bvjvzxqjj-bwk&e=  and the lab webpage https://urldefense.proofpoint.com/v2/url?u=https-3a__mro.oru.se_&d=dwifaw&c=clk7kqutwtaveovigvi0nu5bouhhpn0h8p7csfnc_gi&r=0w3solp5fswiywf2rl6rss8mcefamfepafdtohgtfyi&m=rl8hzbmngi0wmbu3bzec2g7cezck2kgw4jq2ti8pbqi&s=xwt_uolyqluptjcztzz_micg-ccork0gpd74mslrsta&e=   researchers at aass come from a dozen different countries, in europe and worldwide, and have different scientific and cultural backgrounds. we are involved in several european and international projects, frequently host international researchers and seminars, resulting in ample travel and collaboration opportunities for our phd students. application: please apply through our online application system: https://urldefense.proofpoint.com/v2/url?u=https-3a__www.oru.se_english_working-2dat-2dorebro-2duniversity_jobs-2dand-2dvacancies_job_-3fjid-3d20170301&d=dwifaw&c=clk7kqutwtaveovigvi0nu5bouhhpn0h8p7csfnc_gi&r=0w3solp5fswiywf2rl6rss8mcefamfepafdtohgtfyi&m=rl8hzbmngi0wmbu3bzec2g7cezck2kgw4jq2ti8pbqi&s=qs-q6mdlx3rm0imiejct85kn8jc7dr10xgawnw0nvhs&e=  contact: dr. todor stoyanov (todor.stoyanov at oru.se) dr. martin magnusson (martin.magnusson at oru.se)  prof. achim j. lilienthal (achim.lilienthal at oru.se) "
120,2017,postdoctoral researcher in 3d perception," postdoctoral researcher in 3d perception center for applied autonomous sensor systems (aass) ?rebro university,  sweden   ---------------------------------------------------------------------------------- summary: the center for applied autonomous sensor systems (aass) at ?rebro university,  sweden  is looking to employ a postdoctoral researcher in computer science, with a focus on 3d scene modeling and articulated object tracking. the position is for a 2 year work contract with an internationally competitive salary and full social security benefits. we offer you the opportunity to  make the first steps of your independent research career: work on an exciting and practically relevant problem alongside an ambitious international research team and in close cooperation with industrial partners.  about the position: the postdoctoral post is associated with the nationally funded collaborative project tracmac, which  aims at developing a remote sensing system for the tracking of articulated objects. the position will also involve collaboration with industrial partners (atlas copco and brokk), as well as work in a scientific research team at aass. duties of the researcher will involve the design, implementation, and evaluation of prototype software modules for 3d sensor data analysis. your responsibilities will include travel to partner sites, data collection, as well as the design, implementation and evaluation of a prototype tracking system.   requirements: * a completed phd degree in computer science, control theory, robotics, or a related discipline. the degree should have been attained within the past three years (time spent on parental leave and civil service can be deducted). * solid theoretical background in computer vision and 3d modeling. * prior experience in registration, mapping, or object detection / recognition. * excellent programming skills and knowledge of c++ and ros. * experience in collaborative projects is a plus. about the work environment: the center for applied autonomous sensor systems (aass), located in the city of ?rebro in central  sweden , carries out multi-disciplinary research at the intersection of robotics, machine learning, artificial intelligence, computer vision, computer science, and measurement technology.  aass is internationally renowned for its research in mobile robotics, cognitive robotic systems, robot ecologies, and artificial olfaction. further information can be found at https://urldefense.proofpoint.com/v2/url?u=https-3a__www.oru.se_aass&d=dwifaw&c=clk7kqutwtaveovigvi0nu5bouhhpn0h8p7csfnc_gi&r=0w3solp5fswiywf2rl6rss8mcefamfepafdtohgtfyi&m=hmm25i2ouqncoadcyo4rlie3ogtp4dxewhijjosznza&s=frlq2llqbm9ss_wumrmd0xyeg3uc5oxamo9xd7cuhf0&e=  and the lab webpage https://urldefense.proofpoint.com/v2/url?u=https-3a__mro.oru.se_&d=dwifaw&c=clk7kqutwtaveovigvi0nu5bouhhpn0h8p7csfnc_gi&r=0w3solp5fswiywf2rl6rss8mcefamfepafdtohgtfyi&m=hmm25i2ouqncoadcyo4rlie3ogtp4dxewhijjosznza&s=hxstsb-ppewf76vuvkdievi4sxxcutfyqiy8y-cb0n0&e=   researchers at aass come from a dozen different countries, in europe and worldwide, and have different scientific and cultural backgrounds. we are involved in several european and international projects, frequently host international researchers and seminars, resulting in ample travel and collaboration opportunities for our researchers. application: please apply through our online application system: https://urldefense.proofpoint.com/v2/url?u=https-3a__www.oru.se_english_working-2dat-2dorebro-2duniversity_jobs-2dand-2dvacancies_job_-3fjid-3d20170299&d=dwifaw&c=clk7kqutwtaveovigvi0nu5bouhhpn0h8p7csfnc_gi&r=0w3solp5fswiywf2rl6rss8mcefamfepafdtohgtfyi&m=hmm25i2ouqncoadcyo4rlie3ogtp4dxewhijjosznza&s=zr0hkd6ekqmhlrnor9zqoym_qeu4hutalgx07rm8kkq&e=  contact: dr. todor stoyanov (todor.stoyanov at oru.se)"
