,year,subject,content
10,2020,"postdoc and phd opportunities in aerial  robotics (swarms, gnss-denied flying,  darpa)  at multi-robot systems group - czech technical university in prague"," postdoc and phd opportunities in aerial robotics (swarms, gnss-denied flying, darpa)  at multi-robot systems group - czech technical university in prague job description --------------------- three postdoc positions in aerial robotics:  the postdoctoral researcher will work on single and/or multi-robot systems to enable the deployment of fleets of uavs in real-world environments. the work can be in any field, including motion and path planning, control, coordination, flocking, sensors and sensor fusion, computer vision, obstacle avoidance, high level planning, and scheduling. the researcher will advise and co-advise a team of phd and master?s students (usually a group of 3-6 students) to support the candidates? research intentions.  additionally, a team of hw engineers at mrs group will support research by maintaining 30+ swarm aerial platforms dedicated to deployment in demanding outdoor environments with obstacles. although the positions are targeted for fundamental research of the postdoc candidate (continuation in prior research of the postdoc candidate is preferred), involvement of the researcher with the application-oriented projects of the group is also welcome as we believe that robotics should be motivated by applications. the candidate can contribute in the following projects:  aerial-core: aerial cognitive integrated multi-task robotic system with extended operation range and safety https://urldefense.com/v3/__http://mrs.felk.cvut.cz/projects/aerial-core__;!!lir3w8kk_xxm!_yw_avxlwjc88n3cy_sfxdmku26liiov9bc95wm0d99q2ie3rse4o-h5v9ahqdlv_umjmgip$   the eu h2020 ict-10-2019-2020: robotics core technology project enables cooperation with the best aerial robotic groups in europe, including the groups of davide scaramuzza, dario floreano, anibal ollero, bruno siciliano, antonio franchi, stjepan bogdan, etc. the main objective is an interaction of teams of aerial co-workers and human workers providing maintenance of infrastructure at high altitude. [1] t uzakov, t p nascimento and m saska. uav vision-based nonlinear formation control applied to inspection of electrical power lines. in icuas, 2020. darpa subterranean challenge https://urldefense.com/v3/__http://mrs.felk.cvut.cz/projects/darpa__;!!lir3w8kk_xxm!_yw_avxlwjc88n3cy_sfxdmku26liiov9bc95wm0d99q2ie3rse4o-h5v9ahqdlv_xdkdom4$  we will be participating in the darpa competition as the ctu-cras-norlab team. full funding has been received after winning 1st place among the self-funded teams for the urban & tunnel circuits in 2019 and 2020. [1] m petrlik, t baca, d hert, m vrba, t krajnik, and m saska. a robust uav system for operations in a constrained environment. ieee robotics and automation letters (ral) 5, april 2020. mbzirc 2023 competition https://urldefense.com/v3/__http://mrs.felk.cvut.cz/mbzirc2020__;!!lir3w8kk_xxm!_yw_avxlwjc88n3cy_sfxdmku26liiov9bc95wm0d99q2ie3rse4o-h5v9ahqdlv_uqv7box$  , https://urldefense.com/v3/__http://mrs.felk.cvut.cz/mbzirc__;!!lir3w8kk_xxm!_yw_avxlwjc88n3cy_sfxdmku26liiov9bc95wm0d99q2ie3rse4o-h5v9ahqdlv_aevgstv$   we aim to build upon the successes of mbzirc 2020 in which our team won 1st place in the grand challenge, 1st place in challenge 2, and 2nd place in challenge 1 and mbzirc 2017, where we placed 1st in challenge 3, 2nd in challenge 1, and 3rd in the grand challenge. [1] t b??a, p ?t?p?n, v spurn?, d he?t, r p?ni?ka, m saska, j thomas, g loianno and v kumar. autonomous landing on a moving vehicle with an unmanned aerial vehicle. journal of field robotics 36(5):874-891, 2019. [2] v spurn?, t b??a, m saska, r p?ni?ka, t krajn?k, j thomas, d thakur, g loianno and v kumar. cooperative autonomous search, grasping, and delivering in a treasure hunt scenario by a team of unmanned aerial vehicles. journal of field robotics 36(1):125-148, 2019. [3] p ?t?p?n, t krajnik, m petrlik and m saska. vision techniques for on-board detection, following and mapping of moving targets. journal of field robotics 36(1):252-269, 2019.  [4] j faigl, p vana, r penicka and m saska. unsupervised learning based flexible framework for surveillance planning with aerial vehicles. journal of field robotics 36(1):270-301, 2019. dronument: a system for documentation of historical monuments by a team of unmanned aerial vehicles https://urldefense.com/v3/__http://mrs.felk.cvut.cz/projects/dronument__;!!lir3w8kk_xxm!_yw_avxlwjc88n3cy_sfxdmku26liiov9bc95wm0d99q2ie3rse4o-h5v9ahqdlv_r4pdfav$   the goal of the dronument project is to create an aerial platform enabling interior and exterior documentation of heritage sites. this includes development of software for data acquisition and processing, as well as a system for data distribution amongst the heritage sector.  [1] v kr?tk?, p petr??ek, v spurn? and m saska. autonomous reflectance transformation imaging by a team of unmanned aerial vehicles. ieee robotics and automation letters 5(2):2302-2309, april 2020.  [2] p petr??ek, v kr?tk? and m saska. dronument: system for reliable deployment of micro aerial vehicles in dark areas of large historical monuments. ieee robotics and automation letters 5(2):2078-2085, april 2020. eagle.one - autonomous aerial drone hunter https://urldefense.com/v3/__https://eagle.one/en/__;!!lir3w8kk_xxm!_yw_avxlwjc88n3cy_sfxdmku26liiov9bc95wm0d99q2ie3rse4o-h5v9ahqdlv_rnh4bnc$   in the project, onboard sensing, artificial intelligence, and precise predictive control is used to protect borders, jails, and prisons from forbidden objects delivered by drones. [1] m vrba and m saska. marker-less micro aerial vehicle detection and localization using convolutional neural networks. ieee robotics and automation letters 5(2):2459-2466, april 2020. [2] m vrba, d he?t and m saska. onboard marker-less detection and localization of non-cooperating drones for their safe interception by an autonomous aerial system. ieee robotics and automation letters 4(4):3402-3409, october 2019. uav swarming in real forests: https://urldefense.com/v3/__http://mrs.felk.cvut.cz/research/swarm-robotics__;!!lir3w8kk_xxm!_yw_avxlwjc88n3cy_sfxdmku26liiov9bc95wm0d99q2ie3rse4o-h5v9ahqdlv_y6ckony$  research of swarms aims to integrate the principles and theoretical background of swarm behaviours with methodology and theory describing cooperative localization of autonomous robots and principles of self-organizing adaptation leading to a flexible, stand-alone system. it enables applicability of swarm robotics in realistic outdoor scenarios of surveillance and reconnaissance. we develop principles of a decentralized relative localization of neighboring particles that are integrated to swarm behaviors with an aim to keep reciprocal visibility between neighbors. [1] petr??ek, pavel; walter, viktor; b??a, tom??; saska, martin. bio-inspired compact swarms of micro aerial vehicles without communication and external localization. accepted in bioinspiration & biomimetics. 2020. [2] v walter, m vrba and m saska. on training datasets for machine learning-based visual relative localization of micro-scale uavs. in 2020 ieee international conference on robotics and automation (icra). 2020, 10674-10680. [3] m saska, d hert, t baca, v kratky and t nascimento. formation control of unmanned micro aerial vehicles for straitened environments. autonomous robots, pages 1573-7527, 2020. [4] v walter, n staub, a franchi and m saska. uvdar system for visual relative localization with application to leader?follower formations of multirotor uavs. ieee robotics and automation letters 4(3):2637-2644, july 2019. mrs system for research of teams of aerial vehicles. (source code: https://urldefense.com/v3/__http://github.com/ctu-mrs/mrs_uav_system__;!!lir3w8kk_xxm!_yw_avxlwjc88n3cy_sfxdmku26liiov9bc95wm0d99q2ie3rse4o-h5v9ahqdlv_xbtyk1_$  ) candidates may benefit from our ready-to-use system in ros with gazebo simulation and real uav platforms available. for a complete list of publications using this system, see https://urldefense.com/v3/__http://mrs.felk.cvut.cz/publications__;!!lir3w8kk_xxm!_yw_avxlwjc88n3cy_sfxdmku26liiov9bc95wm0d99q2ie3rse4o-h5v9ahqdlv_vxa_3x8$   [1] t.  baca,  m.  petrlik,  m.  vrba,  v.  spurny,  r.  penicka,  d.  hert,  andm.  saska,  ?the  mrs  uav  system:  pushing  the  frontiers  of  reproducible  research,  real-world  deployment,  and  education  with  autonomous unmanned aerial vehicles,? 2020, arxiv: 2008.08050. work benefits ------------------ the positions are fully funded with social benefits and an offered salary competitive to most  research positions in european countries (three times the average salary in the czech republic for postdocs and twice the average salary in the czech republic for phds), enabling a comfortable life in the historical centre of prague. our group provides a friendly working atmosphere with organized team-building events, such as ski trips, hikes, barbecue parties, and mainly our outdoor experimental camps in the countryside (3-4 camps per year), where we enjoy the opportunity of unlimited outdoor flying in various environments (field, forest, lake, urban, etc.). about our group ---------------------- multi-robot systems (mrs) group at czech technical university in prague integrates various research disciplines required for the design, implementation, experimental evaluation, and application of complex robotic systems in real-world conditions. research streams followed by mrs group members include motion and trajectory planning, locomotion generation, control, communication, coordination, image processing, and stabilization of groups of ground and aerial robots. from the application point of view, mrs deals with environment monitoring by swarms of micro aerial vehicles, self-stabilized convoys of ground and aerial robots, search & rescue robotics, monitoring and mapping of historical buildings by aerial robots, and aerial manipulation, among others. we are proud of our successes at international robotic competitions, such as the mbzirc and darpa.  required skills -------------------- for postdoc positions: - a phd degree in computer engineering, artificial intelligence, computer science, robotics, swarms, or related fields - excellent track record (publications in high-if conferences and journals) - excellent written and spoken english skills- strong experience with publication activities - experience with real uav systems is an advantage, but not required (mainly in the case of swarm positions)  - passion for robotics, mathematics, programming, and abstract thinking   - ability to develop and implement complex algorithms efficiently - experience with ros, gazebo, and git is desirable for phd positions: - a master?s degree in computer engineering, computer science, robotics, or related fields - excellent results during master?s studies (student publications or project results) - experience with c++ is strongly required starting date ------------------ your employment can start immediately, but later starts are also possible. how to apply and contact ----------------------------------- please send to martin.saska at fel.cvut.cz  the following information: 1. letter of motivation with specification of your interest and experience with aerial robots (in case of aerial robotic positions) and swarms (in case of swarm positions).  2. your cv, with links to your homepage and videos/results if available. 3. publication list and copies of 3 major publications for questions, please contact me directly: martin.saska at fel.cvut.cz best regards, martin -------------------------------------------------------------------------------------------------- dr. martin saska head of multi-robot systems group faculty of electrical engineering czech technical university in prague karlovo n?m?st? 13 cz 121 35 prague 2 office: e120 voice: +420-776241932 https://urldefense.com/v3/__http://mrs.felk.cvut.cz/__;!!lir3w8kk_xxm!_yw_avxlwjc88n3cy_sfxdmku26liiov9bc95wm0d99q2ie3rse4o-h5v9ahqdlv_tomguc0$  https://urldefense.com/v3/__http://mrs.felk.cvut.cz/people/martin-saska__;!!lir3w8kk_xxm!_yw_avxlwjc88n3cy_sfxdmku26liiov9bc95wm0d99q2ie3rse4o-h5v9ahqdlv_sz3clfq$  -- sent from: https://urldefense.com/v3/__http://robotics-worldwide.1046236.n5.nabble.com/__;!!lir3w8kk_xxm!_yw_avxlwjc88n3cy_sfxdmku26liiov9bc95wm0d99q2ie3rse4o-h5v9ahqdlv_ebhisio$ "
11,2020,"robotics - design,  modeling and control: tenure track position @ ctu prague"," the department of cybernetics (https://urldefense.com/v3/__https://cyber.felk.cvut.cz/__;!!lir3w8kk_xxm!5t82ddxjix9l-bnb9wzmpavtc37d2fqi47tyzqvfrzuihmvhynfkkejobwxd8zrjfutxqukk$ ), faculty of electrical engineering, czech technical university in prague, is opening a tenure-track position in robotics. we invite applications from outstanding candidates that would further widen and strengthen the excellent research and teaching environment at the department.  about the department: the department of cybernetics has a strong track record in machine perception and computer vision. more recently, there has been substantial development in robotics, with groups focusing on search and rescue robotics (https://urldefense.com/v3/__https://cyber.felk.cvut.cz/vras__;!!lir3w8kk_xxm!5t82ddxjix9l-bnb9wzmpavtc37d2fqi47tyzqvfrzuihmvhynfkkejobwxd8zrjfhuxfygm$ ), aerial robotics and swarms of drones (https://urldefense.com/v3/__http://mrs.felk.cvut.cz__;!!lir3w8kk_xxm!5t82ddxjix9l-bnb9wzmpavtc37d2fqi47tyzqvfrzuihmvhynfkkejobwxd8zrjfhbq5e-r$ ) and humanoid robotics (https://urldefense.com/v3/__https://cyber.felk.cvut.cz/humanoids__;!!lir3w8kk_xxm!5t82ddxjix9l-bnb9wzmpavtc37d2fqi47tyzqvfrzuihmvhynfkkejobwxd8zrjfhsg6h5e$ ). the groups, together with roboticists from the department of computer science, form the center for robotics and autonomous systems (https://urldefense.com/v3/__https://robotics.fel.cvut.cz/cras__;!!lir3w8kk_xxm!5t82ddxjix9l-bnb9wzmpavtc37d2fqi47tyzqvfrzuihmvhynfkkejobwxd8zrjft4cv-vo$ ). the robotics teams have recently succeeded in numerous competitions: ctu team ranked 3rd overall and 1st among self-funded teams in tunnel circuit round (2019) and the urban circuit (2020) of the darpa subterranean challenge; the ?drone team?  won the 1st place in grand challenge, 1st place in challenge 2, and 2nd place in challenge 1 of the mohamed bin zayed international robotics challenge 2020. hardware infrastructure at the department includes wheeled, tracked, and legged robots for search and rescue operation, industrial as well as collaborative or lightweight manipulators (kuka lbr iiwa, ur10e with airskin, kinova gen3), flying robots - fleets of uavs, and humanoid robots (2x nao; icub - in production).  the department has access to a high-performance computational cluster dedicated to the artificial intelligence research and developments using traditional multi-cpu systems, but also gpus.  professional support is provided by the administration and project office with long experience of managing international projects.  there is currently a highly dynamic research environment in prague beyond the department, as witnessed by for example the research center for informatics (https://urldefense.com/v3/__http://rci.cvut.cz__;!!lir3w8kk_xxm!5t82ddxjix9l-bnb9wzmpavtc37d2fqi47tyzqvfrzuihmvhynfkkejobwxd8zrjflcbsthw$ ) or prague ai (https://urldefense.com/v3/__https://prg.ai/en__;!!lir3w8kk_xxm!5t82ddxjix9l-bnb9wzmpavtc37d2fqi47tyzqvfrzuihmvhynfkkejobwxd8zrjfmrvir0m$ ). czech technical university in prague received the eu hr award, a commitment to open, transparent and merit-based recruitment of researchers and to equal opportunity policies. what we expect:  we are looking for a researcher with expertise in robotics, preferably in the domain of robot mechatronics design, robot control and modeling. the candidate should be visible at leading robotics conferences and journals and have experience in real (beyond simulation) robotics. we seek a candidate who will complement our current research expertise at the department. see the robotics groups profiles, https://urldefense.com/v3/__http://cyber.felk.cvut.cz/vras__;!!lir3w8kk_xxm!5t82ddxjix9l-bnb9wzmpavtc37d2fqi47tyzqvfrzuihmvhynfkkejobwxd8zrjfma-d9px$ , https://urldefense.com/v3/__https://cyber.felk.cvut.cz/humanoids__;!!lir3w8kk_xxm!5t82ddxjix9l-bnb9wzmpavtc37d2fqi47tyzqvfrzuihmvhynfkkejobwxd8zrjfhsg6h5e$ , and https://urldefense.com/v3/__http://mrs.felk.cvut.cz__;!!lir3w8kk_xxm!5t82ddxjix9l-bnb9wzmpavtc37d2fqi47tyzqvfrzuihmvhynfkkejobwxd8zrjfhbq5e-r$ .  the candidate is expected to collaborate with all robotics groups at the department. in the long run, the candidate should establish her own research group. the candidate is also expected to teach within cybernetics and robotics (https://urldefense.com/v3/__https://kyr.fel.cvut.cz/en__;!!lir3w8kk_xxm!5t82ddxjix9l-bnb9wzmpavtc37d2fqi47tyzqvfrzuihmvhynfkkejobwxd8zrjfpkbpaim$ ) and/or open informatics (https://urldefense.com/v3/__https://oi.fel.cvut.cz/en__;!!lir3w8kk_xxm!5t82ddxjix9l-bnb9wzmpavtc37d2fqi47tyzqvfrzuihmvhynfkkejobwxd8zrjfk0dicqb$ ) study programmes. what we offer: a starting package for three years that includes full funding of the candidate, two phd students and an appropriate share of administrative support. after three years, the candidate will be evaluated with the possibility of extending the contract or transforming it to a tenured position. how to apply. the application should include:  	? motivation letter (max. 2 pages) 	? cv (including 3 reference persons)  	? 2 letters of recommendation (can be from the reference persons above) please send the applications or inquiries to kristina luke?ov? (lukeskri at fel.cvut.cz) with ?tenure-track application robotics? in the subject. the position is open until filled.  best regards, tom?? svoboda (chair of department of cybernetics) ---------------------------------------------------------------------- tomas svoboda                             mailto: svobodat at fel.cvut.cz center for machine perception         https://urldefense.com/v3/__http://cmp.felk.cvut.cz/*svoboda__;fg!!lir3w8kk_xxm!5t82ddxjix9l-bnb9wzmpavtc37d2fqi47tyzqvfrzuihmvhynfkkejobwxd8zrjfkcbz8ka$  department of cybernetics (chair)            https://urldefense.com/v3/__http://cyber.felk.cvut.cz__;!!lir3w8kk_xxm!5t82ddxjix9l-bnb9wzmpavtc37d2fqi47tyzqvfrzuihmvhynfkkejobwxd8zrjfsyszg_x$  faculty of electrical engineering           phone: (+420) 224.35.74.48 czech technical university in prague        fax:   (+420) 224.35.73.85"
12,2020,"postdoc,  associate and tenure positions in aerial robotics (swarms,  gnss-denied flying, mrs systems,  darpa) at multi-robot systems group - czech technical university in prague"," postdoc, associate and tenure positions in aerial robotics (swarms, gnss-denied flying, mrs systems, darpa)  at multi-robot systems group - czech technical university in prague job description --------------------- three positions in aerial and swarm robotics:  the researcher will lead a team of phd and master students and work on single and/or multi-robot systems to enable the deployment of fleets of uavs in real-world environments. the work can be in any relevant field, including motion and path planning, control, coordination, flocking, sensors and sensor fusion, computer vision, obstacle avoidance, high level planning, and scheduling. the researcher will advise and co-advise a team of (usually a group of 3-6 students) to support the candidates? research intentions.  additionally, a team of hw engineers at mrs group at czech technical university in prague will support research by maintaining 30+ swarm aerial platforms dedicated to deployment in demanding outdoor environments with obstacles. although the positions are targeted for fundamental research of the candidate (continuation in prior research is preferred), involvement of the researcher with the application-oriented projects of the group is also welcome as we believe that robotics should be motivated by applications.  work benefits ------------------ the positions are fully funded with social benefits and an offered salary competitive to most research positions in european countries, enabling a comfortable life in the historical centre of prague. our group provides a friendly working atmosphere with organized team-building events, such as ski trips, hikes, barbecue parties, and mainly our outdoor experimental camps in the countryside (3-4 camps per year), where we enjoy the opportunity of unlimited outdoor flying in various environments (field, forest, lake, urban, etc.). about our group ---------------------- multi-robot systems (mrs) group (mrs.felk.cvut.cz) at czech technical university in prague integrates various research disciplines required for the design, implementation, experimental evaluation, and application of complex robotic systems in real-world conditions. research streams followed by mrs group members include motion and trajectory planning, locomotion generation, control, communication, coordination, image processing, and stabilization of groups of ground and aerial robots. from the application point of view, mrs deals with environment monitoring by swarms of micro aerial vehicles, self-stabilized convoys of ground and aerial robots, search & rescue robotics, monitoring and mapping of historical buildings by aerial robots, and aerial manipulation, among others. we are proud of our successes at international robotic competitions, such as the mbzirc and darpa. for more projects and results see: mrs.felk.cvut.cz  required skills -------------------- for all positions: - a phd degree in computer engineering, artificial intelligence, computer science, robotics, swarms, or related fields - excellent track record (publications in high-if conferences and journals) - excellent written and spoken english skills- strong experience with publication activities - experience with real uav systems is an advantage, but not required (mainly in the case of swarm positions)  - passion for robotics, mathematics, programming, and abstract thinking   - ability to develop and implement complex algorithms efficiently - experience with ros, gazebo, and git is desirable for associate and tenure positions: - a postdoc or industrial experience in an active robotic team - experience with supervising students on master or phd levels starting date ------------------ your employment can start immediately, but later starts are also possible. how to apply and contact ----------------------------------- please send to martin.saska at fel.cvut.cz  the following information: 1. letter of motivation with specification of your interest and experience with aerial robots (in case of aerial robotic positions) and swarms (in case of swarm positions).  2. your cv, with links to your homepage and videos/results if available. 3. publication list and copies of 3 major publications for questions, please contact me directly: martin.saska at fel.cvut.cz best regards, martin -------------------------------------------------------------------------------------------------- dr. martin saska head of multi-robot systems group faculty of electrical engineering czech technical university in prague karlovo n?m?st? 13 cz 121 35 prague 2 office: e120 voice: +420-776241932 mrs.felk.cvut.cz/ mrs.felk.cvut.cz/people/martin-saska -- sent from: https://urldefense.com/v3/__http://robotics-worldwide.1046236.n5.nabble.com/__;!!lir3w8kk_xxm!8fhixhwycoecred10fi179odovt3x5vnoien8xd-nl_kmkyvda7bvs1yurhsyfolw-9kpgvx$ "
