,year,subject,content
4,2019,"3-year postdoc positions in hri and nlp  at heriot-watt university, edinburgh, uk"," as part of an upcoming eu h2020 project, the interactionlab at heriot-watt university is advertising multiple 3-year postdoc positions. please, see below for more information. the posts will be located in the interaction lab at heriot-watt university's school of mathematics and computer science (macs), see https://urldefense.proofpoint.com/v2/url?u=http-3a__www.macs.hw.ac.uk_interactionlab&d=dwigaq&c=clk7kqutwtaveovigvi0nu5bouhhpn0h8p7csfnc_gi&r=0w3solp5fswiywf2rl6rss8mcefamfepafdtohgtfyi&m=vuzcwsbdinval92wenzkgltjnpxqx3mdoxggkofcskg&s=2dltlrh7a6topxhre5gml8kwssnn0-bidncj4tgcquw&e= . the successful candidates will join a group of about 20 people, consisting of postdoctoral and phd researchers and faculty with expertise in nlp, machine learning, hri, and conversational interfaces. our current projects involve collaborations with the university of glasgow, idiap (geneva), laas (toulouse), speechgraphics and others. we also competed in the amazon alexa challenge 2017 and 2018, on conversational ai, having reached the final on both occasions. the advertised positions will be part of the new ?socially pertinent robots in gerontological healthcare (spring)? horizon 2020 eu project. in spring, we are particularly interested in socially assistive robots (sars) for the elderly. it is necessary that these sars are able to understand various individual and group situations, take appropriate decisions, and engage in face-to-face multi-modal dialogue with multiple people. these scenarios are typical of a large variety of social situations that often occur in practice, well beyond healthcare. spring, therefore, aims to enable sars to fulfil social roles and successfully execute tasks by equipping them with the ability to move, see, hear and communicate in complex and unstructured populated spaces. spring is comprised of a highly international project with academic and industry partners in france,  spain , israel, the czech republic, italy, and the uk. the following links might only work in incognito mode. please contact me if you have problems accessing the webpages. ************************************************************************************************ postdoc in human-robot interaction: https://urldefense.proofpoint.com/v2/url?u=https-3a__www.hw.ac.uk_about_work_jobs_job-5fsvjdmjqzmtu.htm&d=dwigaq&c=clk7kqutwtaveovigvi0nu5bouhhpn0h8p7csfnc_gi&r=0w3solp5fswiywf2rl6rss8mcefamfepafdtohgtfyi&m=vuzcwsbdinval92wenzkgltjnpxqx3mdoxggkofcskg&s=lgkusx-k6s45qskto1idi_zpcivbqp9nuvqznimlrp0&e=  the focus of this position is on action planning and execution for human-robot interaction (hri) in group scenarios. the main duties are to implement/adapt and evaluate a socially intelligent multi-party hri planning and execution system for a sar, and to collect and analyse multimodal data. the successful applicant is expected to perform collaborative research on planning, hri, ai and machine learning within an international consortium, publish at high-impact conferences and journals in their field, and disseminate their work at national and international conferences and outreach events. experience with machine learning methods in planning for hri is highly desirable. key duties and responsibilities: * to implement a planning and execution framework for hri for group interaction and general task management; * to collect and analyse multimodal interaction data in the lab and in the unstructured target environment; * to integrate the system on a socially assistive robot. essential criteria: * experience (at phd level or equivalent) with hri/hci, robotics, planning, ai, machine learning, or related research areas; * software development in python2/3 and other languages such as java, c++, matlab, etc.; * experience at conducting experiments with human participants for system evaluation. desirable criteria: * experience in robotics and the use of socially assistive robots * experience in the use of middleware such as the robot operating system (ros); * collaborative research experience in large projects; * prior research in the field of multi-party hri; * experience with mobile robots for hri; * research experience with planning, robots in healthcare (for older adults), and/or long-term deployments of robots; ************************************************************************************************ postdoc in conversational ai and natural language processing: https://urldefense.proofpoint.com/v2/url?u=https-3a__www.hw.ac.uk_about_work_jobs_job-5fsvjdmjqzmty.htm&d=dwigaq&c=clk7kqutwtaveovigvi0nu5bouhhpn0h8p7csfnc_gi&r=0w3solp5fswiywf2rl6rss8mcefamfepafdtohgtfyi&m=vuzcwsbdinval92wenzkgltjnpxqx3mdoxggkofcskg&s=fnhwf9yv6drkb5bdewcnjxdj3r4fzo6rpzoovdhm-6w&e=  the focus of this position is on natural language processing (nlp) for multi-party interaction. the main duties are to implement/adapt and evaluate a socially intelligent multi-party conversational system for a sar, and to collect and analyse multimodal conversational data. the successful applicant is expected to perform collaborative research on ai, nlp and machine learning within an international consortium, publish at high-impact conferences and journals in their field, and disseminate their work at national and international conferences and outreach events. experience with machine learning methods in conversational ai and spoken dialogue systems/nlp is highly desirable. key duties and responsibilities: * to implement/adapt and evaluate socially intelligent conversational interfaces for multi-party natural language processing; * to implement conversational ai applications using machine learning techniques for multi-party dialogue management, natural language understanding, and natural language generation; * to collect and analyse multimodal conversational interaction data in the lab and in the unstructured target environment; * to integrate the system on a socially assistive robot. essential criteria: * experience (at phd level or equivalent) with nlp, dialogue systems, ai, machine learning, or related research areas; * software development in python2/3 and other languages such as java, c++, matlab, etc.; * experience at conducting experiments with human participants for system evaluation. desirable criteria: * experience in the use of middleware such as the robot operating system (ros) and/or socket-based communication using flask; * collaborative research experience in large projects; * prior research in the field of multi-party conversational ai; * research experience with speech recognition and synthesis, natural language understanding, natural language generation, dialogue management; * experience in conversational systems for robotics; * prior research experience in the health sector preferably in care for older adults. ************************************************************************************************ for any further questions, please do not hesitate to contact c.dondrup at hw.ac.uk<mailto:c.dondrup at hw.ac.uk>. -- dr christian dondrup assistant professor emb g.27 | +44 (0) 131 451 3814 school of mathematical and computer sciences heriot-watt university ________________________________ heriot-watt university is the times & the sunday times international university of the year 2018 founded in 1821, heriot-watt is a leader in ideas and solutions. with campuses and students across the entire globe we span the world, delivering innovation and educational excellence in business, engineering, design and the physical, social and life sciences. this email is generated from the heriot-watt university group, which includes:   1.  heriot-watt university, a scottish charity registered under number sc000278   2.  heriot- watt services limited (oriam), scotland's national performance centre for sport. heriot-watt services limited is a private limited company registered is scotland with registered number sc271030 and registered office at research & enterprise services heriot-watt university, riccarton, edinburgh, eh14 4as. the contents (including any attachments) are confidential. if you are not the intended recipient of this e-mail, any disclosure, copying, distribution or use of its contents is strictly prohibited, and you should please notify the sender immediately and then delete it (including any attachments) from your system."
5,2019,"post-doc and phd opportunities in  aerial robotics, swarms, and motion planning"," post-doc and phd opportunities in aerial robotics, swarms, and motion planning at multi-robot systems group - czech technical university in prague. jobs description --------------------- post-doc position in aerial robotics:  the postdoctoral researcher will work on multi-robot systems, to enable deployment of fleets of uavs in real-world environments. the researcher will be advising and co-advising a team of phd and master students (usually a group of 3-6 students) to support the candidate's research intention. although the position is targeted on fundamental research of the post-doc candidate (continuation in prior research of the post-doc candidate is preferred), involvement of the researcher into the application-oriented projects of the group is also welcome, as we believe that robotics should be motivated by applications. post-doc position on aerial co-worker: the position will be funded by european union within the project aerial-core: aerial cognitive integrated multi-task robotic system with extended operation range and safety https://urldefense.proofpoint.com/v2/url?u=http-3a__mrs.felk.cvut.cz_projects_aerial-2dcore&d=dwifaq&c=clk7kqutwtaveovigvi0nu5bouhhpn0h8p7csfnc_gi&r=0w3solp5fswiywf2rl6rss8mcefamfepafdtohgtfyi&m=aqr5m36kakmeh9qr14arbxhtwyn2prrjurqyz7ls8pe&s=liaiwop77yie6urn2rledjz0plk1y1st0xlhg7gy6b4&e=  in h2020 ict-10-2019-2020: robotics core technology. the eu project enables cooperation with the best aerial robotic groups in europe, including groups of davide scaramuzza, dario floreano, anibal ollero, bruno siciliano, antonio franchi, stjepan bogdan, etc. the main objective is an interaction of teams of aerial co-workers and human workers providing maintenance of infrastructure at high altitude. post-doc position in swarm robotics: we seek for candidates with swarm and/or multi-robot expertise to help us with our endeavour towards swarming of large teams of aerial robots in real-world conditions (such as getting swarms of autonomous drones into a forest https://urldefense.proofpoint.com/v2/url?u=https-3a__youtu.be_nsiqyv0alxu&d=dwifaq&c=clk7kqutwtaveovigvi0nu5bouhhpn0h8p7csfnc_gi&r=0w3solp5fswiywf2rl6rss8mcefamfepafdtohgtfyi&m=aqr5m36kakmeh9qr14arbxhtwyn2prrjurqyz7ls8pe&s=_-cojzpqa0utf83cic7lbkuqfib8eupn74tgyzy4bqi&e= ). the researcher will be advising and co-advising a team of phd and master students (usually a group of 3-6 students) to support his research intention. besides, a team of hw engineers of mrs group will support the research by maintaining 20+ swarm aerial platforms dedicated to deployment in demanding outdoor environments with obstacles.  in this position, continuation in prior research of the post-doc candidate is preferred, and the position is proper for researchers that would like to evaluate swarming approaches with real multi-robot systems. post-doc position in motion planning: the postdoctoral researcher will work on sampling-based planning of actions and motions using approximate solutions, within a project that aims to develop novel sampling-based motion planning methods for scenarios with narrow passages. the researcher will be advising and co-advising a team of phd and master students (usually a group of 3-6 students) to support his research intention. 2 phd positions in motion planning: the phd students will work on sampling-based planning of actions and motions using approximate solutions, within a project that aims to develop novel sampling-based motion planning methods for scenarios with narrow passages.  work benefits ------------------ the positions are fully funded with social benefits. the offered salary is competitive to most of the research positions in european countries (3 times of average salary in the czech republic for post-docs and 2 times of average salary in the czech republic for phds) and enables a comfortable life in the historical centre of prague.  our group provides a friendly work atmosphere. we organize a lot of team-building events, such as ski trips, hikes, barbecue parties, and mainly our outdoor experimental camps in countryside (3-4 camps per year), where we enjoy an opportunity of outdoor unlimited flying in various environments (field, forest, lake, urban, ...) together with team-building evening discussions around a campfire (usually 20-30 people participate every day). about our group ---------------------- multi-robot systems (mrs) group at czech technical university in prague integrates various research disciplines required for design, implementation, experimental evaluation, and application of complex robotic systems in real-world conditions. research streams followed by mrs group members include motion and trajectory planning, locomotion generation, control, communication, coordination, image processing, and stabilization of groups of ground and aerial robots. from the application point of view, mrs deals with environment monitoring by swarms of micro aerial vehicles, self-stabilized convoys of ground and aerial robots, search & rescue robotics,  monitoring and mapping of historical buildings by aerial robots, aerial manipulation, etc. we are proud of our successes at international robotic competitions, such as mbzirc, where our team presented the best performance in multi-robot aerial robotic challenge out of 140 registered participant from the best robotic groups world-wide.  our key projects: ----------------------- mohamed bin zayed international robotics challenge (winner of the 3rd challenge of mbzirc 2017): https://urldefense.proofpoint.com/v2/url?u=http-3a__mrs.felk.cvut.cz_mbzirc&d=dwifaq&c=clk7kqutwtaveovigvi0nu5bouhhpn0h8p7csfnc_gi&r=0w3solp5fswiywf2rl6rss8mcefamfepafdtohgtfyi&m=aqr5m36kakmeh9qr14arbxhtwyn2prrjurqyz7ls8pe&s=92_4haxeqiai1f6w5b9cowo71ua7umior2q3lv8powi&e=  a system for recording historical buildings using multiple unmanned aerial vehicles: https://urldefense.proofpoint.com/v2/url?u=http-3a__mrs.felk.cvut.cz_research_historical-2dmonuments-2ddocumentation&d=dwifaq&c=clk7kqutwtaveovigvi0nu5bouhhpn0h8p7csfnc_gi&r=0w3solp5fswiywf2rl6rss8mcefamfepafdtohgtfyi&m=aqr5m36kakmeh9qr14arbxhtwyn2prrjurqyz7ls8pe&s=0q6or-yz1nswv4kofsqk11jtetxlywhqsh7lcxtpjh8&e=  darpa subterranean challenge (winner among self-funded teams): https://urldefense.proofpoint.com/v2/url?u=http-3a__mrs.felk.cvut.cz_darpa&d=dwifaq&c=clk7kqutwtaveovigvi0nu5bouhhpn0h8p7csfnc_gi&r=0w3solp5fswiywf2rl6rss8mcefamfepafdtohgtfyi&m=aqr5m36kakmeh9qr14arbxhtwyn2prrjurqyz7ls8pe&s=nnixughxsydlrseujnn7ee1ps2bauxyjeklvbqgjtx8&e=   swarms of aerial robots: https://urldefense.proofpoint.com/v2/url?u=http-3a__mrs.felk.cvut.cz_research_swarm-2drobotics&d=dwifaq&c=clk7kqutwtaveovigvi0nu5bouhhpn0h8p7csfnc_gi&r=0w3solp5fswiywf2rl6rss8mcefamfepafdtohgtfyi&m=aqr5m36kakmeh9qr14arbxhtwyn2prrjurqyz7ls8pe&s=rbuajarfzryu7zo1yn8xldzlsxmpvg5rhn_xjjikmbk&e=  aerial-core eu project: https://urldefense.proofpoint.com/v2/url?u=http-3a__mrs.felk.cvut.cz_projects_aerial-2dcore&d=dwifaq&c=clk7kqutwtaveovigvi0nu5bouhhpn0h8p7csfnc_gi&r=0w3solp5fswiywf2rl6rss8mcefamfepafdtohgtfyi&m=aqr5m36kakmeh9qr14arbxhtwyn2prrjurqyz7ls8pe&s=liaiwop77yie6urn2rledjz0plk1y1st0xlhg7gy6b4&e=   required skills -------------------- for post-doc positions: - a phd degree in computer engineering, computer science, robotics, or related fields - excellent track record (publications in high-if conferences and journals) - excellent written and spoken english skills. strong experience with publication activities for phd positions: - a master degree in computer engineering, computer science, robotics, or related fields - excellent results during master studies (student publications or project results) - experience with c++ is strongly required for aerial robotic positions: - experience with real uav systems is an advantage  - passion for robotics, mathematics, programming and abstract thinking   - ability to develop and implement complex algorithms efficiently - experience with ros, gazebo, and git is desirable. for swarm position: - experience with swarm robotics or swarm intelligent (experience with physical robotics is not necessary) - strong motivation to deploy achievements of swarm intelligent into real robotic systems starting date ------------------ your employment can start immediately, but later starts are also possible. how to apply and contact ----------------------------------- please send me (martin.saska at fel.cvut.cz) the following information: 1. letter of motivation with specification of your interest and experience with aerial robots (in case of aerial robotic positions), swarms (in case of swarm positions)  and motion planning (in case of motion planning positions).  2. your cv with your homepage and link to videos/results if available. 3. publication list and a copy of your 3 major publications for questions, please contact me directly: martin.saska at fel.cvut.cz best regards, martin -------------------------------------------------------------------------------------------------- dr. martin saska head of multi-robot systems group faculty of electrical engineering czech technical university in prague karlovo n?m?st? 13 cz 121 35 prague 2 office: e120 voice: +420-776241932 https://urldefense.proofpoint.com/v2/url?u=http-3a__mrs.felk.cvut.cz_&d=dwifaq&c=clk7kqutwtaveovigvi0nu5bouhhpn0h8p7csfnc_gi&r=0w3solp5fswiywf2rl6rss8mcefamfepafdtohgtfyi&m=aqr5m36kakmeh9qr14arbxhtwyn2prrjurqyz7ls8pe&s=ccyqvo13_fwr-nffsb6aw8fkpinvppkbmbdslrgolpi&e=  https://urldefense.proofpoint.com/v2/url?u=http-3a__mrs.felk.cvut.cz_people_martin-2dsaska&d=dwifaq&c=clk7kqutwtaveovigvi0nu5bouhhpn0h8p7csfnc_gi&r=0w3solp5fswiywf2rl6rss8mcefamfepafdtohgtfyi&m=aqr5m36kakmeh9qr14arbxhtwyn2prrjurqyz7ls8pe&s=bp_o_fgrqh2yyerupv5ayo2mpv1yudxsscm4l6jw3yy&e=  https://urldefense.proofpoint.com/v2/url?u=http-3a__mrs.felk.cvut.cz_projects_cesnet&d=dwifaq&c=clk7kqutwtaveovigvi0nu5bouhhpn0h8p7csfnc_gi&r=0w3solp5fswiywf2rl6rss8mcefamfepafdtohgtfyi&m=aqr5m36kakmeh9qr14arbxhtwyn2prrjurqyz7ls8pe&s=3hflu2bytfszn_-unrm1bdye5xfl5njo_j1povgffm8&e=  https://urldefense.proofpoint.com/v2/url?u=http-3a__mrs.felk.cvut.cz_projects_mbzirc&d=dwifaq&c=clk7kqutwtaveovigvi0nu5bouhhpn0h8p7csfnc_gi&r=0w3solp5fswiywf2rl6rss8mcefamfepafdtohgtfyi&m=aqr5m36kakmeh9qr14arbxhtwyn2prrjurqyz7ls8pe&s=3aiiqdcasxibv-5xwra9kncftmqg-qd6plgpbnem6t8&e=  -- sent from: https://urldefense.proofpoint.com/v2/url?u=http-3a__robotics-2dworldwide.1046236.n5.nabble.com_&d=dwifaq&c=clk7kqutwtaveovigvi0nu5bouhhpn0h8p7csfnc_gi&r=0w3solp5fswiywf2rl6rss8mcefamfepafdtohgtfyi&m=aqr5m36kakmeh9qr14arbxhtwyn2prrjurqyz7ls8pe&s=reluc2omw1vot7rfnvlodasa9hess26ohz1wwp__n8a&e= "
6,2019,-," vision for robotics and autonomous systems group (https://urldefense.proofpoint.com/v2/url?u=https-3a__cyber.felk.cvut.cz_vras_&d=dwifag&c=clk7kqutwtaveovigvi0nu5bouhhpn0h8p7csfnc_gi&r=0w3solp5fswiywf2rl6rss8mcefamfepafdtohgtfyi&m=mn03y34z4lis4sjmhng8cwqabczlzbxjtblgbjayqwa&s=jcevjdca7atsf7-x7dotd6gwnuqv_0rqbyf3qjk1xoq&e= ) seeks two excellent phd student on the following fully-funded positions: (1) darpa subt phd student/researcher: cutting-edge research in the autonomous mapping (slam) for mobile robotics. we are expanding the team that just won the darpa subt challenge to help us win again and do excellent research on the most challenging topics in robotics! (2) valeo.ai-sponsored phd student/researcher: applied research in self-driving cars. we offer phd position in the university environment while being partially supervised by the top-tier researcher from valeo.ai research group. show your research to be meaningful by running your codes on the real self-driving car to improve human safety. we seek phd candidates:  - who are excellent, self-motivated, and willing to push the boundaries of the state-of-the-art in robotics and ai - have experience in computer science, python/c++ development, optimisation/machine learning - have achieved at least one outstanding result of any form  we offer: - full funding corresponding to the gross salary of czk 40 000 per month (it is approximately 1565 eur per month, and it includes phd stipend and salary from research grants),  - plus direct bonuses for scientific achievements such as accepted top-tier publications or winning in significant ai/robotic challenges. - access to top-tier computational grid and robots - participation in the best scientific conferences and darpa challenge in case of interest, please, send your application by email to the principal investigator karel zimmermann, zimmerk at fel.cvut.cz. the application should be a single pdf file including applicant cv and a short research statement.  doc. ing. karel zimmermann, ph.d.  e-mail:      zimmerk at cmp.felk.cvut.cz            tel: 	    2 2435 5733       		    www:	     https://urldefense.proofpoint.com/v2/url?u=http-3a__cmp.felk.cvut.cz_-7ezimmerk&d=dwifag&c=clk7kqutwtaveovigvi0nu5bouhhpn0h8p7csfnc_gi&r=0w3solp5fswiywf2rl6rss8mcefamfepafdtohgtfyi&m=mn03y34z4lis4sjmhng8cwqabczlzbxjtblgbjayqwa&s=o1-241gbwe16wcc5ereqjisz7zye3v_nmnxpj3xdoyc&e=  office: e226			            address:   cvut-fel,karlovo nam. 13, praha "
