,year,subject,content
16,2016,postdoctoral research fellow in  computational imaging for marine robotics in sydney," *faculty of engineering and itaustralian centre for field robotics, university of sydney* *reference no. 2624/1114c*    - *be part of the development of novel computational imaging systems for    challenging underwater applications*    - *join a world-class marine robotics research team*    - *full-time fixed term two years, remuneration package: $117k-$139k    p.a. which includes leave loading and up to 17% super* the university of sydney is australia's first university and has an outstanding global reputation for academic and research excellence. it employs over 7600 permanent staff, supporting over 60,000 students. the university of sydney?s australian centre for field robotics (acfr) is one of australia?s leading robotics research groups and undertakes fundamental and applied research in the area of robotic systems and their application to a variety of scientific and industrial domains. their marine systems group is focused on the development of novel imaging payloads, sensors and vehicle systems for marine survey, visualization, clustering and classification of extensive marine-based image archives, characterization of change in multi-year surveys and adaptive mission planning for multi-vehicle systems. they lead australia?s integrated marine observing system (imos) auv facility and undertake marine surveys at sites around australia and overseas. the acfr is seeking to appoint one postdoctoral research fellow associated with its marine systems group as part of an arc discovery project with collaborators in computational imaging at stanford, indiana university, israel institute of technology and university of rhode island.  the successful candidate will undertake fundamental and applied research related to the development, design and deployment of novel computational or plenoptic imaging systems in challenging underwater applications. the project will establish a photometric underwater image formation model and leverage it in designing lightfield cameras tailored to specific tasks, exploiting the imaging model?s ability to rapidly explore camera design space. targeted autonomous underwater vehicle (auv) and remotely operated vehicle (rov) deployments include environmental monitoring, archaeological and geological imaging on sites in the mediterranean, on the great barrier reef, and around tasmania. you will have a phd in a relevant field and extensive knowledge of optics and imaging systems. practical knowledge of computational imaging systems is desirable. with support from the acfrs technical and research staff, as well as specialist partner investigators at other institutions, you will be involved in the full project lifecycle, from design and construction of novel cameras to testing, evaluation and field deployment. the position is full-time fixed term for one and a half years, subject to the completion of a satisfactory probation period for new appointees. there is the possibility of extension of the position for a further six months, subject to funding and need. *to be considered for this position it is essential that you address the online selection criteria. **for guidance on how to apply visit: **how to apply for an advertised position. <https://urldefense.proofpoint.com/v2/url?u=http-3a__sydney.edu.au_recruitment_recruitment-2dprocess_&d=dqifaq&c=clk7kqutwtaveovigvi0nu5bouhhpn0h8p7csfnc_gi&r=0w3solp5fswiywf2rl6rstc00sfv_qvwqlcnmghkrrotmim5rlso-ftzvw2nfnyo&m=qpwmt93manvnjnpafgnpvczgoynyqp15rjhkoute0xc&s=taaq0zivborslwbz4guronnxg_ylvypjetg4ub1kvqa&e= >* general enquiries can be directed to dan kuhner on 02 8627 0934  *closing date: *8 september 2016 (11.30pm sydney time) the university is an equal opportunity employer committed to equity, diversity and social inclusion. applications from equity target groups, including women and people with disabilities are encouraged. as the university of sydney has established a scheme to increase the number of aboriginal and torres strait islander staff employed across the institution, applications from people of aboriginal and torres strait islander descent are also encouraged. the university reserves the right not to proceed with any appointment. selection criteria <https://urldefense.proofpoint.com/v2/url?u=http-3a__sydney.nga.net.au_publicfiles_sydney_jobs_4f4c3b07-2d7909-2d4fbd-2dbc3f-2da65f00e40324_selection-2520criteria-252011.08.16.docx&d=dqifaq&c=clk7kqutwtaveovigvi0nu5bouhhpn0h8p7csfnc_gi&r=0w3solp5fswiywf2rl6rstc00sfv_qvwqlcnmghkrrotmim5rlso-ftzvw2nfnyo&m=qpwmt93manvnjnpafgnpvczgoynyqp15rjhkoute0xc&s=qatz0tqm_fpsxbyllxrxafshg9nf3crbqfr7jqgen-8&e= > how to apply:    - application details can be found here    <https://urldefense.proofpoint.com/v2/url?u=http-3a__sydney.nga.net.au_cp_index.cfm-3fevent-3djobs.checkjobdetailsnewapplication-26returntoevent-3djobs.processjobsearch-26jobid-3d4f4c3b07-2d7909-2d4fbd-2dbc3f-2da65f00e40324-26curatc-3dext-26curbid-3d949319bc-2d8898-2d4f11-2dac4b-2d9db401358504-26jobslistkey-3dfebcbb88-2dbeec-2d4250-2d9bc5-2dbc7808385711-26persistvariables-3dcuratc-2ccurbid-2cjobslistkey-2cjobid-26lid-3d57555730028&d=dqifaq&c=clk7kqutwtaveovigvi0nu5bouhhpn0h8p7csfnc_gi&r=0w3solp5fswiywf2rl6rstc00sfv_qvwqlcnmghkrrotmim5rlso-ftzvw2nfnyo&m=qpwmt93manvnjnpafgnpvczgoynyqp15rjhkoute0xc&s=6tcp1x_icx4-jpvan8qg3zetybq_eu3qfxvdpvc4av8&e= >    . by choosing to continue, you agree to the privacy policy. show privacy policy <https://urldefense.proofpoint.com/v2/url?u=http-3a__sydney.nga.net.au_cp_index.cfm-3fevent-3dja.showprivacypolicy-26curatc-3dext-26curbid-3d949319bc-252d8898-252d4f11-252dac4b-252d9db401358504-26jobslistkey-3dfebcbb88-252dbeec-252d4250-252d9bc5-252dbc7808385711-26jobid-3d4f4c3b07-252d7909-252d4fbd-252dbc3f-252da65f00e40324-26returntoevent-3djobs-252eprocessjobsearch-26persistvariables-3dcuratc-2ccurbid-2cjobslistkey-2cjobid-2creturntoevent-26lid-3d12463640004&d=dqifaq&c=clk7kqutwtaveovigvi0nu5bouhhpn0h8p7csfnc_gi&r=0w3solp5fswiywf2rl6rstc00sfv_qvwqlcnmghkrrotmim5rlso-ftzvw2nfnyo&m=qpwmt93manvnjnpafgnpvczgoynyqp15rjhkoute0xc&s=k4zwue5ri7fe_uaxfwkpzbud6oj6uq7giabnfcowxoq&e= >"
17,2016,"phd and postdoc positions in belief 	space planning and active perception at the technion, israel"," fully funded phd and postdoc positions are available at the technion ? israel institute of technology.  the objective of the project is to investigate novel approaches for belief-space planning and active perception in the context of single- and multi-robot autonomous navigation and active slam. the successful candidate(s) will work with assist. prof. vadim indelman within the recently established autonomous navigation and perception lab (anpl). depending on the candidate?s background and interests, the position can involve fundamental research, algorithmic implementation and experimental validation on aerial and/or ground robots. funds for some conference travel and research expenses will be provided.  applicants should submit a cover letter that briefly describes their background and career plans, cv and three professional references. please send all application materials to vadim.indelman at technion.ac.il <mailto:vadim.indelman at technion.ac.il>. starting date is flexible, however applications are encouraged to be submitted by october 31st.  for more information, please visit https://urldefense.proofpoint.com/v2/url?u=http-3a__vindelman.net.technion.ac.il&d=dqifaq&c=clk7kqutwtaveovigvi0nu5bouhhpn0h8p7csfnc_gi&r=0w3solp5fswiywf2rl6rss8mcefamfepafdtohgtfyi&m=kqgzxlrr_v2nfzncn6wjy9uocx1j08r0ndtmkhwepdi&s=tdjwvc1lgpygoimlxu362fnjr1_1xg6wefgye1q5d3o&e=  <https://urldefense.proofpoint.com/v2/url?u=http-3a__vindelman.net.technion.ac.il_&d=dqifaq&c=clk7kqutwtaveovigvi0nu5bouhhpn0h8p7csfnc_gi&r=0w3solp5fswiywf2rl6rss8mcefamfepafdtohgtfyi&m=kqgzxlrr_v2nfzncn6wjy9uocx1j08r0ndtmkhwepdi&s=btv96abmkkqobmcgrgvnqv7xpbp5d0hzlzo_vo1bc2s&e= > or contact via email.  *** if you attend iros?16, feel free to get in touch with assist. prof. vadim indelman for an informal chat. ? vadim indelman, ph.d. assistant professor autonomous navigation and perception lab department of aerospace engineering technion - israel institute of technology tel:     +972-4-829-3815 email:  <>vadim.indelman at technion.ac.il <mailto:vadim.indelman at technion.ac.il> web:   https://urldefense.proofpoint.com/v2/url?u=http-3a__vindelman.net.technion.ac.il_&d=dqifaq&c=clk7kqutwtaveovigvi0nu5bouhhpn0h8p7csfnc_gi&r=0w3solp5fswiywf2rl6rss8mcefamfepafdtohgtfyi&m=kqgzxlrr_v2nfzncn6wjy9uocx1j08r0ndtmkhwepdi&s=btv96abmkkqobmcgrgvnqv7xpbp5d0hzlzo_vo1bc2s&e=  <https://urldefense.proofpoint.com/v2/url?u=http-3a__vindelman.net.technion.ac.il_&d=dqifaq&c=clk7kqutwtaveovigvi0nu5bouhhpn0h8p7csfnc_gi&r=0w3solp5fswiywf2rl6rss8mcefamfepafdtohgtfyi&m=kqgzxlrr_v2nfzncn6wjy9uocx1j08r0ndtmkhwepdi&s=btv96abmkkqobmcgrgvnqv7xpbp5d0hzlzo_vo1bc2s&e= >"
18,2016,15 phd student positions in social 	robotics for socrates etn," *====================================* *15 phd student positions in social robotics* *====================================* ** socrates**is a new marie sk?odowska-curie european training network  (etn) comprising 7 universities/research institutes and 8 non?academic  organisations/companies. in total 15 early stage researchers (esrs) will  be recruited as phd students for research on various aspects of  interactive social robotics aiming at eldercare. the wide range of  projects covers a spectrum from technical design of hardware and  interaction methodology, to personalisation, user studies, and robot  ethics.positions are open at; ume? university,  sweden ; ?rebro university,  sweden ; universit?t hamburg, germany; fraunhofer ipa, stuttgart, germany; csic barcelona,  spain , university of the west of england, bristol, england; ben-gurion university of the negev, beer sheva, israel. *expected starting date is 1st of april 2017. closing date for  applications is 30th of november 2016.* for more information on the positions, please refer to  www.socrates-project.eu  <https://urldefense.proofpoint.com/v2/url?u=http-3a__www.socrates-2dproject.eu&d=dqmdaq&c=clk7kqutwtaveovigvi0nu5bouhhpn0h8p7csfnc_gi&r=0w3solp5fswiywf2rl6rss8mcefamfepafdtohgtfyi&m=drxhz_rumcqccx_exmunswb2zgyx4rkg9_z67k5r0yu&s=nysh0uazll3v5tozq-gojhxuagdlqe0heitaz12-mts&e=>.  for general information about socrates, please contact the project  coordinator, professor thomas hellstr?m (thomash -at- cs.umu.se) at ume?  university,  sweden . **"
19,2016,"two fully funded ph.d positions in  social robotics @ aass, orebro university,  sweden "," the centre for applied autonomous sensor systems (aass)  at ?rebro university has openings for 2 fully funded  phd  projects (4 years) in social robotics. the phds will specifically be on 1.) social robotic telepresence with sliding autonomy and 2.) measuring interaction effectiveness in social robotics. the recruitment is done as part of socrates (social cognitive robotic agents in the european society), a new marie sk?odowska-curie european training network (etn). more information on each position and how to apply is provided below. the expected starting date for both phd positions is 1st of april. we want your applications no later than november 30, 2016. for formal inquiry contact: prof. amy loutfi (amy.loutfi at oru.se) research topics ---------------------------- topic 1: social robotic telepresence with sliding autonomy mobile robotic telepresence is used as a social communication aid for older adults, with remote users steering the robot in its environment using feedback from a robot's sensors. for unfamiliar drivers, this often creates a heavy workload and therefore reduces focus on social interaction. one way to reduce the workload is to introduce autonomy to assist the remote user in operating the robot. sliding autonomy is a way to automatically adapt the level of autonomy depending on the current context.the researcher will study how sliding autonomy can be implemented in social robotic telepresence by taking into considerations non-verbal cues as well as social norms. the researcher will also study the effect of sliding autonomy on the workload for operating the robot, and on the associated interaction quality. the researcher will undertake two secondments: (1) an academic secondment to ben-gurion university of the negev in beersheba, israel, to work on interface design for teleoperated robots; (2) an industrial secondment to fraunhofer ipa in stuttgart, germany, to study cost-effective solutions to support sliding autonomy. further information about this position, the requirements and how to apply can be found at: https://urldefense.proofpoint.com/v2/url?u=https-3a__www.oru.se_english_working-2dat-2dorebro-2duniversity_jobs-2dand-2dvacancies_-3frm&d=dqif_w&c=clk7kqutwtaveovigvi0nu5bouhhpn0h8p7csfnc_gi&r=0w3solp5fswiywf2rl6rss8mcefamfepafdtohgtfyi&m=nczkyeigkwf9huchiefz8vfgf7qkdfyyghctwntgu1y&s=lzkvht9pxz-7m3xjfycpz1hfqza_eb3ci65hfomsab0&e=  page=job&rmjob=2553&rmlang=uk topic 2: measuring interaction effectiveness in social robotics initial studies on mobile robotic telepresence suggest that evaluation using a combination of qualitative and quantitative data can lead to a greater understanding of the perceived safety and security. the research goal for this particular position is to test this hypothesis, and to extend the work to include autonomous robot systems operating at varying levels of autonomy, and with varying levels of social behavior. the end result will advance the soa regarding autonomous systems supporting independent living with respect to: (1) the systems? ability to increase the sense of safety and security, (2) the relation between interaction quality, level of autonomy and sense of safety and security, and (3) new quantitative measures that can support qualitative evaluation tools. during a secondment  to ben-gurion university of the negev in beersheba, israel, evaluation procedures will be compared and combined. during an industrial secondment to fraunhofer ipa in stuttgart, alternative approaches to evaluation of social robots will be investigated and compared, possibly leading to modified procedures. further information about this position, the requirements and how to apply can be found at: https://urldefense.proofpoint.com/v2/url?u=https-3a__www.oru.se_english_working-2dat-2dorebro-2duniversity_jobs-2dand-2dvacancies_-3frm&d=dqif_w&c=clk7kqutwtaveovigvi0nu5bouhhpn0h8p7csfnc_gi&r=0w3solp5fswiywf2rl6rss8mcefamfepafdtohgtfyi&m=nczkyeigkwf9huchiefz8vfgf7qkdfyyghctwntgu1y&s=lzkvht9pxz-7m3xjfycpz1hfqza_eb3ci65hfomsab0&e=  page=job&rmjob=2554&rmlang=uk about ?rebro university and aass ----------------------------------------------- ?rebro university is seeking outstanding candidates for two phd positions in computer science at the center of applied autonomous  sensor systems. the centre for applied autonomous sensor systems (aass), carries out multi-disciplinary research environment at ?rebro university in the intersection of robotics, machine learning, artificial intelligence, and computer science. successful applicants will join the aass (applied autonomous sensor systems) research unit (https://urldefense.proofpoint.com/v2/url?u=http-3a__www.oru.se_aass&d=dqif_w&c=clk7kqutwtaveovigvi0nu5bouhhpn0h8p7csfnc_gi&r=0w3solp5fswiywf2rl6rss8mcefamfepafdtohgtfyi&m=nczkyeigkwf9huchiefz8vfgf7qkdfyyghctwntgu1y&s=b66frycb1clpvv8uaass4d8a5cuxijz2xy1n8fnefow&e= ) at ?rebro university,  sweden . salaries for phd students at ?rebro university are internationally competitive. with over 40 senior researchers and phd students, aass is one of the largest robotics research groups in  sweden . the research and human environment at aass is young and enthusiastic, and phd students come from many different countries and have different scientific and cultural backgrounds. about socrates ------------------------- the recruitment is done as part of socrates (social cognitive robotic agents in the european society), a new marie sk?odowska-curie european training network (etn) comprising  7 universities/research institutes: ume? university and ?rebro university in  sweden , universit?t hamburg and fraunhofer ipa, stuttgart in germany, csic barcelona in  spain , university west of england, and ben-gurion university of the negev in israel. additional non-academic partners are: pal robotics, adele robots, alfred nobel science park, urquhart-dykes & lord llp,  center for digital innovation, uminova, asea brown boveri, s.a, and fundaci? ace. in total 15 early stage researchers (esrs) will be recruited as phd students for research on various aspects of interactive social robotics aiming at eldercare.  the wide range of projects covers a spectrum from technical design of hardware and interaction methodology, to personalisation, user studies, and robot ethics. the unique multidisciplinary programme will train researchers with both academic and entrepreneurial spirit and expertise, well suited for a career in both academy and industry.  the successful applicants will join a training program in close cooperation with researchers from all partners. the recruitment aims at a balanced gender distribution, and in particular women are encouraged to apply. the network-wide training program includes a research project, courses, seminars, and workshops. an overview of all available positions can be found at https://urldefense.proofpoint.com/v2/url?u=http-3a__www.socrates-2dproject.eu_&d=dqif_w&c=clk7kqutwtaveovigvi0nu5bouhhpn0h8p7csfnc_gi&r=0w3solp5fswiywf2rl6rss8mcefamfepafdtohgtfyi&m=nczkyeigkwf9huchiefz8vfgf7qkdfyyghctwntgu1y&s=1n-ubu4ncj1fa7tbflljayaiyqtv25kvdnz18cuizbs&e= ."
20,2016,bristol robotics  laboratory - marie curie positions in hri safety and robot ethics," dear colleagues socrates (social cognitive robotic agents in the european society) is a new marie sk?odowska-curie european training network (etn) comprising 7 universities/research institutes: ume? university and ?rebro university in  sweden , universit?t hamburg and fraunhofer ipa, stuttgart in germany, csic barcelona in  spain , university west of england, and ben-gurion university of the negev in israel. additional non-academic partners are: pal robotics, adele robots, alfred nobel science park, urquhart-dykes & lord llp, center for digital innovation, uminova, asea brown boveri, s.a, and fundaci? ace. we are looking for 2 outstanding and highly motivated individuals to join socrates project in bristol in two research projects: 1. robot interaction safety design (https://urldefense.proofpoint.com/v2/url?u=http-3a__brl.ac.uk_jobsatbrl.aspx&d=dqifaq&c=clk7kqutwtaveovigvi0nu5bouhhpn0h8p7csfnc_gi&r=0w3solp5fswiywf2rl6rss8mcefamfepafdtohgtfyi&m=fbh3m7ofhdw-vmtl48md0n2x5bfcebzcvo210jqjsak&s=ksgosidgmyj2rsofwe6rneavjk5lijv-vm-cjpzod8e&e= ), vacancy number 1595173 2. ethical robot interaction (https://urldefense.proofpoint.com/v2/url?u=http-3a__brl.ac.uk_jobsatbrl.aspx&d=dqifaq&c=clk7kqutwtaveovigvi0nu5bouhhpn0h8p7csfnc_gi&r=0w3solp5fswiywf2rl6rss8mcefamfepafdtohgtfyi&m=fbh3m7ofhdw-vmtl48md0n2x5bfcebzcvo210jqjsak&s=ksgosidgmyj2rsofwe6rneavjk5lijv-vm-cjpzod8e&e= ), vacancy number 1595168 about the position the positions include a competitive salary for a period of three years full-time research, provided that expected study and research results are achieved. the salary will be based on the standard marie sk?odowska-curie early-stage researcher living and mobility allowances. career exploratory allowance and travel allowances will be available. expected starting date for the phd position is 1st of april 2017. based in the bristol robotic laboratory, the largest centre for multi-disciplinary robotics research in the uk, this is an exciting opportunity to join a dynamic team of roboticists, neuropsychologists and business experts. admission requirements prerequisites include 240 ects credits of higher education studies. 60 ects have to be on advanced level (master level). 90 ects credits have to be in the area of engineering or computer science. eligible are also applicants who have acquired essentially equivalent knowledge. in addition to excellent study results, fluency in written and spoken english is required. experience in robotics and machine learning are merits, as well as documented relevant programming skills. to promote mobility, the following rule applies: at the time of recruitment, the applicants must not have resided or carried out their main activity in uk for more than 12 months during the last 3 years. compulsory national service, work in international organisations, and short stays such as holidays are not taken into account. we are looking forward to receiving your application dr sanja dogramadzi associate professor bristol robotics laboratory university of the west of england coldharbour lane, frenchay bristol, uk tel: +44 117 32 81301 email: sanja.dogramadzi at brl.ac.uk  -- view this message in context: https://urldefense.proofpoint.com/v2/url?u=http-3a__robotics-2dworldwide.1046236.n5.nabble.com_eurobotics-2ddist-2djobs-2dbristol-2drobotics-2dlaboratory-2dmarie-2dcurie-2dpositions-2din-2dhri-2dsafety-2dand-2drobot-2dethics-2dtp5714869.html&d=dqifaq&c=clk7kqutwtaveovigvi0nu5bouhhpn0h8p7csfnc_gi&r=0w3solp5fswiywf2rl6rss8mcefamfepafdtohgtfyi&m=fbh3m7ofhdw-vmtl48md0n2x5bfcebzcvo210jqjsak&s=bytimvs3riqhwzus61nqxuigi8-krskn5jvm6htsz1o&e=  sent from the robotics-worldwide mailing list archive at nabble.com."
21,2016,"2 phd student positions at iri, csic,   spain  (socrates - marie sklodowska-curie action -)"," ==========================================================================================  2 phd student positions at iri, csic-upc,  spain  (socrates - marie  sk?odowska-curie action) ==========================================================================================  iri, csic in barcelona,  spain , is seeking outstanding candidates for 2  phd student positions in the project socrates. socrates (social cognitive robotic agents in the european society), is a  new marie sk?odowska-curie european training network (etn) comprising 7  universities/research institutes: ume? university and ?rebro university  in  sweden , universit?t hamburg and fraunhofer ipa, stuttgart in germany,  csic barcelona in  spain , university west of england, and ben-gurion  university of the negev in israel. additional non-academic partners are:  pal robotics, adele robots, alfred nobel science park, urquhart-dykes &  lord llp, center for digital innovation, uminova, asea brown boveri,  s.a, and fundaci? ace. research projects iri-csic offers two research projects for two phd candidates: 1) adaption through multimodal interaction and learning:  https://urldefense.proofpoint.com/v2/url?u=http-3a__www.iri.upc.edu_jobs_38&d=dqidaq&c=clk7kqutwtaveovigvi0nu5bouhhpn0h8p7csfnc_gi&r=0w3solp5fswiywf2rl6rss8mcefamfepafdtohgtfyi&m=tsbr-rsq22rxknpoy0o8jhgqotw98hyhtqdybkyxhfa&s=1lrhntmk8jdvtcwv1refcuxlcy7so6_kvhkk0jff8h8&e=  2) robot personalisation: https://urldefense.proofpoint.com/v2/url?u=http-3a__www.iri.upc.edu_jobs_39&d=dqidaq&c=clk7kqutwtaveovigvi0nu5bouhhpn0h8p7csfnc_gi&r=0w3solp5fswiywf2rl6rss8mcefamfepafdtohgtfyi&m=tsbr-rsq22rxknpoy0o8jhgqotw98hyhtqdybkyxhfa&s=x3gdgkhfn2gv5a_osobs2cdbkhzzrlb_cmrgmqw8x74&e=  about the positions: both positions include a competitive salary for a period of three years  full time research time, provided that expected study and research  results are achieved. the salary will be based on the standard marie  sk?odowska-curie early-stage researcher living allowance and mobility  allowance, as well as family allowance, if applicable. career  exploratory allowance and travel allowances will be available. expected  starting date for the phd position is 1st of april 2017. admission requirements: -  the candidate is expected to have a degree/master in computer  engineering, computer science, or a related field. -  mobility rule: at the time of recruitment, the applicants must not  have resided or carried out their main activity in  spain  for more than  12 months during the last 3 years. compulsory national service, work in  international organisations, and short stays such as holidays are not  taken into account. -  requirements to be enrolled in a doctoral programme in  spain : 300  ects credits of higher education studies, including at least 60 ects on  master level. -  experience in machine learning, and robotics are merits, as well as  documented relevant programming skills. how to apply: please, send an e-mail to jobs at iri.upc.edu before 30/11/2016, and  include the following documentation: - introductory letter with a statement of research interest - a curriculum vitae - if applicable, copy of completed msc thesis and publications - copies of degree certificates, including documentation of academic  courses and grades - contact information to two persons willing to act as references we are looking forward to receiving your application. best regards, --  institut de rob?tica i inform?tica industrial (iri), csic-upc tel: +34 93 401 57 83, fax: +34 93 401 57 50 @iri_robotics --"
