,year,subject,content
0,2011,"postdoctoral position on robotics, brno university of technology, czech republic (vitezslav beran)","post doctoral (research) recruitment

department of computer graphics and multimedia, faculty of information
technology, brno university of technology

multi-year research position


job description:

the successful candidate for this position will have the chance to
develop new modules and sub-systems on robotic platform. the focus of
the development is on:
  * sensory data processing, signal processing, and/or image processing,
  * environment modeling and understanding,
  * robot localization,
  * mission planning, and
  * robot user interface for remote operators.
our platform is based on robot operating system (ros) that integrates
developed modules.

job responsibilities include among others the following:
  * participate in all aspects of a robotic technologies with an
    emphasis on research, development, and implementation,
  * lead the research, design, and implementation of various components
    of a robotic system,
  * help with the design, implementation, and data analysis of various
    experiments needed to fulfill the mission of our research projects,
  * interact with various members of a research team, supervise
    graduate students, publication and presentation,
  * evaluate, install, and maintain software packages, and
  * administer the computing infrastructure.

the positions are initially limited to 12 months but can be extended
to 24 months based on a successful evaluation after the first 8
months. the gross salary will be 2,000 eur per month. anticipated
starting date is january 1st, 2012 (can be negotiated).



qualifications:

applicants should have (by the starting date) a phd in computer
science and/or cognitive science or related areas and ideally should
have a strong background in one of the research areas, namely:
  * low- and mid-level processing of sensor data,
  * machine learning,
  * machine perception,
  * robotic systems,
  * automation and control.
knowledge of c/c++ is necessary.


how to apply:

to apply, please send completed applications including a complete cv,
two representative published manuscripts, and the names and contact
information of 2 references to:

prof. pavel zemcik
vice-dean for external relations
bozetechova 2
612 66  brno
czech republic
e-mail: prodekan-zahranici at fit.vutbr.cz
web: www.fit.vutbr.cz

you may also contact vitezslav beran, ph.d. via email
(beranv at fit.vutbr.cz) for additional information.
screening begins september 15th, 2011 and will continue until the
position is filled. the position may begin as early as january 1st,
2012, or soon thereafter.

the scientific and research activities at the faculty of information
technology at brno university of technology are directed towards
up-to-date research areas concerning the theory, methods and
applications of information technologies.

we urge all qualified applicants to apply for this position.
appointment will be based on qualifications as they relate to position
requirements without regard to race, color, national origin, religion,
age, sex, disability or veteran status. women and minority candidates
are encouraged to apply.


----------------------------------------------
ing. vítězslav beran, ph.d.
assistant professor
department of computer graphics and multimedia
faculty of information technology
brno university of technology
božetěchova 2, 612 66 brno
czech republic

beranv at fit.vutbr.cz
http://www.fit.vutbr.cz/~beranv
+420 54114-1281"
1,2013,post-doctoral position in robotics and artificial intelligence,"agent technology center
department of computer science and engineering
czech technical university in prague

*** post-doc opening in robotics and artificial intelligence ***

the agent technology center ( http://agents.fel.cvut.cz ) at the czech  
technical university in prague ( http://www.cvut.cz ) is seeking to  
appoint a well-motivated full-time postdoctoral research in the area  
of artificial intelligence applied to robotics in general, and in  
particular to multi-robot systems for autonomous information  
gathering. the position is fully funded (including travel and  
equipment funds).

-----------------------------
main research field: robotics

-----------------------------
sub research field: mobile robotics (ground, aerial, or marine),  
planning, multi-robot systems, multi-agent systems, robotics  
perception and navigation

-----------------------------
job summary:

atg is offering a challenging position as a full-time post-doctoral  
research within the newly establishing computational robotics  
laboratory.
the laboratory is focused on the computational principles employed in  
mobile robotics motivated by deployment of robotic systems to  
autonomous information gathering, e.g., long-term environment  
monitoring, data collecting. research activities address not only  
relevant problems in robotics and artificial intelligence (like  
multi-goal planning, path and motion planning, multi-robot  
exploration, optimal sampling design, multi-robot systems, autonomous  
field navigation) but also application areas where technologies used  
in robotics play an important role, like perception, navigation  
control, automation, simulation, modeling, intelligent systems, etc.

-----------------------------
job description:

the selected candidate will play a key role in developing,  
consolidating and growing the laboratory, enabling and pushing for the  
growth of research results, collaborating in obtaining funding in the  
scope of national and international projects, helping found  
international research collaborations, and setting up research  
resources and processes. it is expected the candidate will supervise  
phd and undergraduate students. an eventual involvement in the  
teaching duties is possible.

-----------------------------
job specification:

the candidate to be hired should have an excellent phd, preferably in  
robotics or computer science.

-----------------------------
main duties:

the successful candidate will join the faculty of electrical  
engineering at the czech technical university and pursue research in  
robotics and artificial intelligence. the candidate will have the  
opportunity to initiate and lead projects and work in  
interdisciplinary teams and may teach undergraduate and graduate  
courses in engineering and perform administrative work.

-----------------------------

contract:

the position is available immediately with an expected start at  
09/2013 for a fixed term with assumed finish at 30/06/2015. a further  
extension is possible.

-----------------------------
application:

to apply, please send a cv, list of publications, obtained research  
funding, research proposal with a potential local collaboration,  
partners, motivation letter, by email to faiglj at fel.cvut.cz. an  
interview and seminar may be requested.

for more information please contact jan faigl (faiglj at fel.cvut.cz or  
+420 22435 5756)

-----------------------------
about agent technology center (atg) at the czech technical university  
- http://agents.fel.cvut.cz

the czech technical university in prague (ctu) is the oldest  
non-military technical university in europe established in 1707. the  
university is continuously increasing its rate and currently 24 000  
students are enrolled. the post-doctoral position is offered within  
the agent technology center (atg), which is a university research  
center within department of computer science and engineering at the  
faculty of electrical engineering (fee), ctu in prague.
the atg is performing fundamental and applied research in the areas of  
multi-agent systems, artificial intelligence, agent-based modeling and  
simulation, collective robotics, machine learning, automated planning,  
game theory, autonomous vehicles, transport system modeling and  
optimization, cyber security and critical infrastructure protection.  
the atg is led by prof. michal pěchouček. the center currently employs  
40 researchers working in small, dynamic teams that bring together  
methods and expertise from diverse areas of artificial intelligence,  
distributed computing and robotics. the center has earned a  
world-class reputation for synergistically interlinking the ability to  
perform fundamental scientific research with strong engineering  
skills, which enables it to integrate and test their scientific  
results as part of larger, application-oriented system prototypes. the  
center has a long history of successful participation in research  
projects funded by czech grant agencies, us defense agencies,  
eu-funded collaborative projects and industry-sponsored research.

in previous years, the atg was closely cooperating with international  
partners on research areas closely related to the topics of this  
project. namely the area of trajectory planning and collision  
avoidance for fixed-wing uavs was investigated in cooperation with us  
army cerdec, motion planning for unmanned helicopters with linköpings  
university, autonomous flight control and task allocation with french  
civil aviation university (enac), agent-based coordination and  
planning techniques for heterogeneous teams in a complex mission with  
university of edinburgh, technion university, university of southern  
california, us army and us air force.

================================================
jan faigl
senior research fellow
assistant professor
agent technology center
department of computer science and engineering
faculty of electrical engineering
czech technical university in prague
technicka 2, 166 27 prague 6, czech republic

mailto: faiglj at fel.cvut.cz
web:    http://agents.fel.cvut.cz/~faigl
web:    http://robotics.fel.cvut.cz/~jf
================================================"
2,2013,post-doc position in robotics and artificial intelligence,"post-doctoral position in robotics and artificial intelligence

agent technology center
department of computer science and engineering
czech technical university in prague

*** post-doc opening in robotics and artificial intelligence ***

the agent technology center ( http://agents.fel.cvut.cz ) at the czech
technical university in prague ( http://www.cvut.cz ) is seeking to appoint
a well-motivated full-time postdoctoral research in the area of artificial
intelligence applied to robotics in general, and in particular to
multi-robot systems for autonomous information gathering. the position is
fully funded (including travel and equipment funds).

-----------------------------
main research field: artificial intelligence in robotics

-----------------------------
sub research field: mobile robotics (ground, aerial, or marine), planning,
multi-robot systems, multi-agent systems, robotics perception and navigation

-----------------------------
job summary:

atg is offering a challenging position as a full-time post-doctoral
research within the newly establishing computational robotics laboratory.
the laboratory is focused on the computational principles employed in
mobile robotics motivated by deployment of robotic systems to autonomous
information gathering, e.g., long-term environment monitoring, data
collecting. research activities address not only relevant problems in
robotics and artificial intelligence (like multi-goal planning, path and
motion planning, multi-robot exploration, optimal sampling design,
multi-robot systems, autonomous field navigation) but also application
areas where technologies used in robotics play an important role, like
perception, navigation control, automation, simulation, modeling,
intelligent systems, etc.

-----------------------------
job description:

the selected candidate will play a key role in developing, consolidating
and growing the laboratory, enabling and pushing for the growth of research
results, collaborating in obtaining funding in the scope of national and
international projects, helping found international research
collaborations, and setting up research resources and processes. it is
expected the candidate will supervise phd and undergraduate students. an
eventual involvement in the teaching duties is possible.

-----------------------------
eligibility:

the candidate to be hired should have an excellent phd, preferably in robotics or computer science finished phd after 03/2011 and at least one contribution in a journal indexed by wos.

-----------------------------
main duties:

the successful candidate will join the faculty of electrical engineering at
the czech technical university and pursue research in robotics and
artificial intelligence. the candidate will have the opportunity to
initiate and lead projects and work in interdisciplinary teams and may
teach undergraduate and graduate courses in engineering and perform
administrative work.

-----------------------------
contract:

the position is available immediately with an expected start at 09/2013 for
a fixed term with assumed finish at 30/06/2015. a further extension is
possible.

-----------------------------
application:

to apply, please send a cv, list of publications, obtained research
funding, research proposal with a potential local collaboration, partners,
motivation letter, and reference letters by email to faiglj at fel.cvut.cz. an
interview and seminar may be requested.

for more information please contact jan faigl (faiglj at fel.cvut.cz or +420
22435 5756)

-----------------------------
about agent technology center (atg) at the czech technical university -
http://agents.fel.cvut.cz

the czech technical university in prague (ctu) is the oldest non-military
technical university in europe established in 1707. the university is
continuously increasing its rate and currently 24 000 students are
enrolled. the post-doctoral position is offered within the agent technology
center (atg), which is a university research center within department of
computer science and engineering at the faculty of electrical engineering
(fee), ctu in prague.
the atg is performing fundamental and applied research in the areas of
multi-agent systems, artificial intelligence, agent-based modeling and
simulation, collective robotics, machine learning, automated planning, game
theory, autonomous vehicles, transport system modeling and optimization,
cyber security and critical infrastructure protection. the atg is led by
prof. michal pěchouček. the center currently employs 40 researchers working
in small, dynamic teams that bring together methods and expertise from
diverse areas of artificial intelligence, distributed computing and
robotics. the center has earned a world-class reputation for
synergistically interlinking the ability to perform fundamental scientific
research with strong engineering skills, which enables it to integrate and
test their scientific results as part of larger, application-oriented
system prototypes. the center has a long history of successful
participation in research projects funded by czech grant agencies, us
defense agencies, eu-funded collaborative projects and industry-sponsored
research.

in previous years, the atg was closely cooperating with international
partners on research areas closely related to the topics of this project.
namely the area of trajectory planning and collision avoidance for
fixed-wing uavs was investigated in cooperation with us army cerdec, motion
planning for unmanned helicopters with linköpings university, autonomous
flight control and task allocation with french civil aviation university
(enac), agent-based coordination and planning techniques for heterogeneous
teams in a complex mission with university of edinburgh, technion
university, university of southern california, us army and us air force.

================================================
jan faigl
senior research fellow
assistant professor
agent technology center
department of computer science and engineering
faculty of electrical engineering
czech technical university in prague
technicka 2, 166 27 prague 6, czech republic

mailto: faiglj at fel.cvut.cz
web:    http://agents.fel.cvut.cz/~faigl
web:    http://robotics.fel.cvut.cz/~jf
================================================"
3,2015,phd or post-doc researcher position  within european project in robotics and education," phd or post-doc researcher position within european project in robotics and education the vision for robotics lab (v4r) at the technische universit?t wien (tu wien) is offering a full time position in the european project er4stem (educational robotics for science technology engineering and mathematics) starting with 1 october 2015 for three years. our project partners are across europe (austria, bulgaria, czech republic, greece,., and wales). occasional traveling will be required. the researcher will lead a work package in the project and will be responsible for the development of the er4stem framework with the aim to turn curious young children into young adults passionate about science and technology with a hands-on use case: robotics. er4stem will refine, unify and enhance current european approaches to stem education through robotics in one open operational and conceptual framework. innovative approaches will be developed to achieve an integrated and consistent concept that picks children up at different ages, beginning in primary school and accompany them until graduation from secondary school. applicants will need a solid background in technology and management, like wirtschaftsingenieurwesen (i.e. engineering and business administration) or industrial engineering, but are not limited to that. background in robotics or education is not mandatory, yet can be helpful. most important are the applicant's motivation and fit into the team, especially skills of interdisciplinary teamwork and international communication, the abilities to structure complex problems, conceptualize different inputs and carry out rigorous high-quality research as well as a passion for teaching children are required. the work will be done under the supervision of project coordinator lara lammer. it is expected that the research work will be published. the position is limited to a 36 month contract from tu wien. payment will be according to the university payment scheme for project assistants, depending on the candidate's experience and qualifications ( http://www.tuwien.ac.at/fileadmin/t/pers1/downloads/personalkostensaetze_2015.pdf ). your application should include a concise cv with your contact information and a one-page motivation letter in which you describe how you would develop the er4stem framework. both to be sent together to lammer at acin.tuwien.ac.at the vision for robotics group (http://v4r.acin.tuwien.ac.at/) is part of the tu wien and located in the centre of vienna. v4r is a leading center of robot vision for service robotics and industrial robot automation. we make robots see and understand the world around them. team spirit, fun, and the strive for novel solutions drive us forward. our passion for teaching unifies us. within the university we are one of the best performing teams. tu wien is located in the heart of europe, in a cosmopolitan city of great cultural diversity. for nearly 200 years, tu wien has been a place of research, teaching and learning in the service of progress. tu wien is among the most successful technical universities in europe and is austria?s largest scientific-technical research and educational institution. more information can be found on: http://tuwien.ac.at historically, vienna has always been a city of science and research and is one of the oldest university cities in europe. the research landscape is shaped by nine universities, five technical colleges, as well as about 1.300 research institutions. working in vienna means finding a creative and stimulating environment. living in vienna also means living in a city that is regularly rated as having the best quality of life. since 1997 the austrian capital has invested approximately eur 400 million into research and technology projects predominantly focused on the key areas of competence, including life science, creative industries, information and communication technologies and transport/logistics. more information can be found on: http://www.wien.gv.at/english/     lara lammer project manager schr?ge roboter <http://schraegeroboter.wordpress.com/> - das kreative mitmachlabor vienna university of technology acin | automation & control institute v4r | vision for robotics group http://www.acin.tuwien.ac.at gusshausstrasse 27-29/e376 1040 vienna, austria"
