,year,subject,content
46,2019,"postdoc position at anpl, technion"," the autonomous navigation and perception lab (anpl) at the technion - israel institute of technology, has an opening for a postdoctoral research fellow.  anpl's research focuses on robust and computationally efficient perception, learning and planning in uncertain/unknown environments. we are looking for a highly motivated strong candidate that will be making key contributions to ongoing research projects (see anpl website) while also developing his/her own research line.   depending on the candidate?s background and interests, the fully-funded position can involve fundamental/applied research, as well as experiments with aerial and/or ground robots. applicants should have a ph.d. (or about to graduate) and a *strong* background in areas such as single and multi-robot planning under uncertainty, visual and semantic slam/perception, and (deep) learning. hands on experience and programming skills are an advantage.   applicants should submit a cover letter that briefly describes their background and career plans, cv and three professional references. please send all application materials to vadim.indelman at technion.ac.il. starting date is flexible, however applications are encouraged to be submitted by end of november 2019.  for more information, please visit https://urldefense.proofpoint.com/v2/url?u=http-3a__vindelman.net.technion.ac.il&d=dwigaq&c=clk7kqutwtaveovigvi0nu5bouhhpn0h8p7csfnc_gi&r=0w3solp5fswiywf2rl6rss8mcefamfepafdtohgtfyi&m=lpaztu0eynod5y5fhc0ordgvfhqdt8y-u3re4r5cwpq&s=dljexxqns6qmnunlaswuesd6llsuzaj7ddge--khw3s&e=  or contact via email.  *** if you attend isrr?19 or iros?19, feel free to get in touch for an informal chat. ? vadim indelman, ph.d. assistant professor autonomous navigation and perception lab technion - israel institute of technology tel:     +972-4-829-3815 email: vadim.indelman at technion.ac.il web:   https://urldefense.proofpoint.com/v2/url?u=http-3a__vindelman.net.technion.ac.il_&d=dwigaq&c=clk7kqutwtaveovigvi0nu5bouhhpn0h8p7csfnc_gi&r=0w3solp5fswiywf2rl6rss8mcefamfepafdtohgtfyi&m=lpaztu0eynod5y5fhc0ordgvfhqdt8y-u3re4r5cwpq&s=x5ejp7mb0xcwlsumrm71uc9dm26ncmssycfnqyate4e&e= "
47,2019,"postdoc position at anpl, technion"," the autonomous navigation and perception lab (anpl) at the technion - israel institute of technology, has an opening for a postdoctoral research fellow.  anpl's research focuses on robust and computationally efficient perception, learning and planning in uncertain/unknown environments. we are looking for a highly motivated strong candidate that will be making key contributions to ongoing research projects (see anpl website) while also developing his/her own research line.  depending on the candidate?s background and interests, the fully-funded position can involve fundamental/applied research, as well as experiments with aerial and/or ground robots. applicants should have a ph.d. (or about to graduate) and a *strong* background in areas such as single and multi-robot planning under uncertainty, visual and semantic slam/perception, and (deep) learning. hands on experience and programming skills are an advantage.   applicants should submit a cover letter that briefly describes their background and career plans, cv and three professional references. please send all application materials to vadim.indelman at technion.ac.il. starting date is flexible, however applications are encouraged to be submitted by end of november 2019.  for more information, please visit https://urldefense.proofpoint.com/v2/url?u=http-3a__vindelman.net.technion.ac.il&d=dwigaq&c=clk7kqutwtaveovigvi0nu5bouhhpn0h8p7csfnc_gi&r=0w3solp5fswiywf2rl6rss8mcefamfepafdtohgtfyi&m=zg2agbvnebvtryszmjmj760epndad7m4v0dya3y5wfy&s=loohsfizu8nplhp2jtm736vdbgxwmvd0rzlxe5hnvbc&e=  or contact via email.  *** if you attend isrr?19 or iros?19, feel free to get in touch for an informal chat. ? vadim indelman, ph.d. assistant professor autonomous navigation and perception lab technion - israel institute of technology tel:     +972-4-829-3815 email: vadim.indelman at technion.ac.il web:   https://urldefense.proofpoint.com/v2/url?u=http-3a__vindelman.net.technion.ac.il_&d=dwigaq&c=clk7kqutwtaveovigvi0nu5bouhhpn0h8p7csfnc_gi&r=0w3solp5fswiywf2rl6rss8mcefamfepafdtohgtfyi&m=zg2agbvnebvtryszmjmj760epndad7m4v0dya3y5wfy&s=wir89dsl6hsdb-mjfpjzjbi4bt6vdfvotckfssuv7dk&e= "
48,2019,"3-year postdoc positions in hri and nlp  at heriot-watt university, edinburgh, uk"," as part of an upcoming eu h2020 project, the interactionlab at heriot-watt university is advertising multiple 3-year postdoc positions. please, see below for more information. the posts will be located in the interaction lab at heriot-watt university's school of mathematics and computer science (macs), see https://urldefense.proofpoint.com/v2/url?u=http-3a__www.macs.hw.ac.uk_interactionlab&d=dwigaq&c=clk7kqutwtaveovigvi0nu5bouhhpn0h8p7csfnc_gi&r=0w3solp5fswiywf2rl6rss8mcefamfepafdtohgtfyi&m=vuzcwsbdinval92wenzkgltjnpxqx3mdoxggkofcskg&s=2dltlrh7a6topxhre5gml8kwssnn0-bidncj4tgcquw&e= . the successful candidates will join a group of about 20 people, consisting of postdoctoral and phd researchers and faculty with expertise in nlp, machine learning, hri, and conversational interfaces. our current projects involve collaborations with the university of glasgow, idiap (geneva), laas (toulouse), speechgraphics and others. we also competed in the amazon alexa challenge 2017 and 2018, on conversational ai, having reached the final on both occasions. the advertised positions will be part of the new ?socially pertinent robots in gerontological healthcare (spring)? horizon 2020 eu project. in spring, we are particularly interested in socially assistive robots (sars) for the elderly. it is necessary that these sars are able to understand various individual and group situations, take appropriate decisions, and engage in face-to-face multi-modal dialogue with multiple people. these scenarios are typical of a large variety of social situations that often occur in practice, well beyond healthcare. spring, therefore, aims to enable sars to fulfil social roles and successfully execute tasks by equipping them with the ability to move, see, hear and communicate in complex and unstructured populated spaces. spring is comprised of a highly international project with academic and industry partners in france,  spain , israel, the czech republic, italy, and the uk. the following links might only work in incognito mode. please contact me if you have problems accessing the webpages. ************************************************************************************************ postdoc in human-robot interaction: https://urldefense.proofpoint.com/v2/url?u=https-3a__www.hw.ac.uk_about_work_jobs_job-5fsvjdmjqzmtu.htm&d=dwigaq&c=clk7kqutwtaveovigvi0nu5bouhhpn0h8p7csfnc_gi&r=0w3solp5fswiywf2rl6rss8mcefamfepafdtohgtfyi&m=vuzcwsbdinval92wenzkgltjnpxqx3mdoxggkofcskg&s=lgkusx-k6s45qskto1idi_zpcivbqp9nuvqznimlrp0&e=  the focus of this position is on action planning and execution for human-robot interaction (hri) in group scenarios. the main duties are to implement/adapt and evaluate a socially intelligent multi-party hri planning and execution system for a sar, and to collect and analyse multimodal data. the successful applicant is expected to perform collaborative research on planning, hri, ai and machine learning within an international consortium, publish at high-impact conferences and journals in their field, and disseminate their work at national and international conferences and outreach events. experience with machine learning methods in planning for hri is highly desirable. key duties and responsibilities: * to implement a planning and execution framework for hri for group interaction and general task management; * to collect and analyse multimodal interaction data in the lab and in the unstructured target environment; * to integrate the system on a socially assistive robot. essential criteria: * experience (at phd level or equivalent) with hri/hci, robotics, planning, ai, machine learning, or related research areas; * software development in python2/3 and other languages such as java, c++, matlab, etc.; * experience at conducting experiments with human participants for system evaluation. desirable criteria: * experience in robotics and the use of socially assistive robots * experience in the use of middleware such as the robot operating system (ros); * collaborative research experience in large projects; * prior research in the field of multi-party hri; * experience with mobile robots for hri; * research experience with planning, robots in healthcare (for older adults), and/or long-term deployments of robots; ************************************************************************************************ postdoc in conversational ai and natural language processing: https://urldefense.proofpoint.com/v2/url?u=https-3a__www.hw.ac.uk_about_work_jobs_job-5fsvjdmjqzmty.htm&d=dwigaq&c=clk7kqutwtaveovigvi0nu5bouhhpn0h8p7csfnc_gi&r=0w3solp5fswiywf2rl6rss8mcefamfepafdtohgtfyi&m=vuzcwsbdinval92wenzkgltjnpxqx3mdoxggkofcskg&s=fnhwf9yv6drkb5bdewcnjxdj3r4fzo6rpzoovdhm-6w&e=  the focus of this position is on natural language processing (nlp) for multi-party interaction. the main duties are to implement/adapt and evaluate a socially intelligent multi-party conversational system for a sar, and to collect and analyse multimodal conversational data. the successful applicant is expected to perform collaborative research on ai, nlp and machine learning within an international consortium, publish at high-impact conferences and journals in their field, and disseminate their work at national and international conferences and outreach events. experience with machine learning methods in conversational ai and spoken dialogue systems/nlp is highly desirable. key duties and responsibilities: * to implement/adapt and evaluate socially intelligent conversational interfaces for multi-party natural language processing; * to implement conversational ai applications using machine learning techniques for multi-party dialogue management, natural language understanding, and natural language generation; * to collect and analyse multimodal conversational interaction data in the lab and in the unstructured target environment; * to integrate the system on a socially assistive robot. essential criteria: * experience (at phd level or equivalent) with nlp, dialogue systems, ai, machine learning, or related research areas; * software development in python2/3 and other languages such as java, c++, matlab, etc.; * experience at conducting experiments with human participants for system evaluation. desirable criteria: * experience in the use of middleware such as the robot operating system (ros) and/or socket-based communication using flask; * collaborative research experience in large projects; * prior research in the field of multi-party conversational ai; * research experience with speech recognition and synthesis, natural language understanding, natural language generation, dialogue management; * experience in conversational systems for robotics; * prior research experience in the health sector preferably in care for older adults. ************************************************************************************************ for any further questions, please do not hesitate to contact c.dondrup at hw.ac.uk<mailto:c.dondrup at hw.ac.uk>. -- dr christian dondrup assistant professor emb g.27 | +44 (0) 131 451 3814 school of mathematical and computer sciences heriot-watt university ________________________________ heriot-watt university is the times & the sunday times international university of the year 2018 founded in 1821, heriot-watt is a leader in ideas and solutions. with campuses and students across the entire globe we span the world, delivering innovation and educational excellence in business, engineering, design and the physical, social and life sciences. this email is generated from the heriot-watt university group, which includes:   1.  heriot-watt university, a scottish charity registered under number sc000278   2.  heriot- watt services limited (oriam), scotland's national performance centre for sport. heriot-watt services limited is a private limited company registered is scotland with registered number sc271030 and registered office at research & enterprise services heriot-watt university, riccarton, edinburgh, eh14 4as. the contents (including any attachments) are confidential. if you are not the intended recipient of this e-mail, any disclosure, copying, distribution or use of its contents is strictly prohibited, and you should please notify the sender immediately and then delete it (including any attachments) from your system."
49,2019,"postdoc position at anpl, technion"," the autonomous navigation and perception lab (anpl) at the technion - israel institute of technology, has an opening for a postdoctoral research fellow.  anpl's research focuses on robust and computationally efficient perception, learning and planning in uncertain/unknown environments. we are looking for a highly motivated strong candidate that will be making key contributions to ongoing research projects (see anpl website) while also developing his/her own research line. depending on the candidate?s background and interests, the fully-funded position can involve fundamental/applied research, as well as experiments with aerial and/or ground robots. applicants should have a ph.d. (or about to graduate) and a *strong* background in areas such as single and multi-robot planning under uncertainty, visual and semantic slam/perception, and (deep) learning. hands on experience and programming skills are an advantage.   applicants should submit a cover letter that briefly describes their background and career plans, cv and three professional references. please send all application materials to vadim.indelman at technion.ac.il. starting date is flexible, however applications are encouraged to be submitted by end of november 2019.  for more information, please visit https://urldefense.proofpoint.com/v2/url?u=http-3a__vindelman.net.technion.ac.il&d=dwigaq&c=clk7kqutwtaveovigvi0nu5bouhhpn0h8p7csfnc_gi&r=0w3solp5fswiywf2rl6rss8mcefamfepafdtohgtfyi&m=3mzgf44978rizhpryrjjnvla6iejud8bubdv0rofbyu&s=gqcll4dtuhizaqyclfrq3j8xyam6efsgykjpwce9fes&e=  or contact via email.  *** if you attend iros?19, feel free to get in touch for an informal chat. ? vadim indelman, ph.d. assistant professor autonomous navigation and perception lab technion - israel institute of technology tel:     +972-4-829-3815 email: vadim.indelman at technion.ac.il web:   https://urldefense.proofpoint.com/v2/url?u=http-3a__vindelman.net.technion.ac.il_&d=dwigaq&c=clk7kqutwtaveovigvi0nu5bouhhpn0h8p7csfnc_gi&r=0w3solp5fswiywf2rl6rss8mcefamfepafdtohgtfyi&m=3mzgf44978rizhpryrjjnvla6iejud8bubdv0rofbyu&s=a-rzvqyo8wo7vnc5lhmajselhc9sm8_zk4nfincykvw&e= "
50,2019,post-doc position at tel-aviv university," the new robotics lab at the school of mechanical engineering at tel-aviv university is searching for candidates for a post-doctoral research position in the area of human-robot collaboration and manipulation planning. the research will be multidisciplinary including motion planning under uncertainty, machine learning and wearable sensing. this is a full time post-doc position for a period of one-year with the possibility for an extension subject to performance and funding. applicants should have a phd in mechanical engineering, electrical engineering, computer science or other relevant field. applicants should also have experience in working with robotic hardware. experience working in motion planning, machine learning and ros is an advantage. other requirements: good programming skills, proficiency in english in both speaking and writing. interested applicants should send their cv, list of publications and at least two letters of recommendation to dr. avishai sintov at: sintov1 at mail.tau.ac.il more information can be viewed in https://urldefense.proofpoint.com/v2/url?u=http-3a__avishaisintov.wordpress.com&d=dwibaq&c=clk7kqutwtaveovigvi0nu5bouhhpn0h8p7csfnc_gi&r=0w3solp5fswiywf2rl6rss8mcefamfepafdtohgtfyi&m=cck-ekrkgkcrga-hqtjrdsssjjmkcqeb9d0xvkropfq&s=usx0nqc60w8xfsdkv21kwecotiwan2vysrd0cdszaqu&e= "
51,2019,phd positions for robot learning," the autonomous intelligent systems laboratory, directed by prof. wolfram burgard and the robot learning laboratory, directed by prof. abhinav valada, of the university of freiburg in germany has open joint full-time phd positions (collective agreement tv-l e13) for researchers to work on the intersection of robotics and machine (deep) learning. both these labs are a part of the newly established ellis unit in the university of freiburg which is one of the first four ellis units in germany and one of the 17 ellis units across ten european countries and israel. outstanding experts in the research fields of simultaneous localization and mapping (slam), long term navigation, autonomous driving, deep learning, computer vision, object detection and tracking, motion planning, mobile manipulation, aerial robotics, brain machine interfaces and many more work in our labs. the job offers a novel perspective to relevant problems in robot perception, state estimation, manipulation, and navigation in order to enable robots to reliably operate in more complex domains and real-world environments. the candidates are expected to conduct independent research and at the same time contribute to the ongoing projects, and guide master and bachelor students. about the candidate: the candidate should hold a master of science degree in robotics, machine learning, computer science, applied mathematics or a related field. the candidate should have a strong mathematical background and programming skills including in deep learning frameworks such as pytorch or tensorflow. prior research experience in one or more of the following areas: deep learning methods for robot vision, navigation and control, deep learning for slam, self-supervised and unsupervised learning, imitation and reinforcement learning, multimodal learning, and autonomous navigation. we furthermore expect outstanding qualifications, the motivation to obtain a doctoral degree and the interest to work in an interdisciplinary environment. finally, we require applicants to have excellent communication skills in english. international candidates are encouraged to apply, knowledge of the german language is not required. about freiburg: wikipedia says about freiburg: ""...the city is known for its ancient university and its medieval munster, as well as for its high standard of living and advanced environmental practices. the city is situated in the heart of a major wine-growing region and serves as the primary tourist entry point to the scenic beauty of the black forest. according to meteorological statistics, the city is the sunniest and warmest in germany..."" the application documents should consist of a single pdf file and include: - motivation letter (expose, respectively) - email addresses of at least two professors or persons authorized to supervise dissertation projects that can provide a reference - curriculum vitae. please indic?ate your rel?ev?ant skills, sci?entific pub?lic?a?tions, awards, research videos and/or code, pro?fes?sional pro?file(s) - bach?elor?s and mas?ter's degrees and unofficial tran?scripts. spe?cify your gpa - any documents providing evidence of academic achievements, relevant practical experience, and qualifications earned at or outside of the university applications should be sent via email to rl-apply at cs.uni-freiburg.de. applications will be considered until the positions have been filled. preference will be given to applications received before january 15, 2020, 23:59 cet."
52,2020,phd positions for robot learning uni  freiburg," the autonomous intelligent systems laboratory, directed by prof. wolfram burgard and the robot learning laboratory, directed by prof. abhinav valada, of the university of freiburg in germany has open joint full-time phd positions (collective agreement tv-l e13) for researchers to work on the intersection of robotics and machine (deep) learning. both these labs are a part of the newly established ellis unit in the university of freiburg which is one of the first four ellis units in germany and one of the 17 ellis units across ten european countries and israel. outstanding experts in the research fields of simultaneous localization and mapping (slam), long term navigation, autonomous driving, deep learning, computer vision, object detection and tracking, motion planning, mobile manipulation, aerial robotics, brain machine interfaces and many more work in our labs. the job offers a novel perspective to relevant problems in robot perception, state estimation, manipulation, and navigation in order to enable robots to reliably operate in more complex domains and real-world environments. the candidates are expected to conduct independent research and at the same time contribute to the ongoing projects, and guide master and bachelor students. about the candidate: the candidate should hold a master of science degree in robotics, machine learning, computer science, applied mathematics or a related field. the candidate should have a strong mathematical background and programming skills including in deep learning frameworks such as pytorch or tensorflow. prior research experience in one or more of the following areas: deep learning methods for robot vision, navigation and control, deep learning for slam, self-supervised and unsupervised learning, imitation and reinforcement learning, multimodal learning, and autonomous navigation. we furthermore expect outstanding qualifications, the motivation to obtain a doctoral degree and the interest to work in an interdisciplinary environment. finally, we require applicants to have excellent communication skills in english. international candidates are encouraged to apply, knowledge of the german language is not required. about freiburg: wikipedia says about freiburg: ""...the city is known for its ancient university and its medieval munster, as well as for its high standard of living and advanced environmental practices. the city is situated in the heart of a major wine-growing region and serves as the primary tourist entry point to the scenic beauty of the black forest. according to meteorological statistics, the city is the sunniest and warmest in germany..."" the application documents should consist of a single pdf file and include: - motivation letter (expose, respectively) - email addresses of at least two professors or persons authorized to supervise dissertation projects that can provide a reference - curriculum vitae. please indic?ate your rel?ev?ant skills, sci?entific pub?lic?a?tions, awards, research videos and/or code, pro?fes?sional pro?file(s) - bach?elor?s and mas?ter's degrees and unofficial tran?scripts. spe?cify your gpa - any documents providing evidence of academic achievements, relevant practical experience, and qualifications earned at or outside of the university applications should be sent via email to rl-apply at cs.uni-freiburg.de. applications will be considered until the positions have been filled. preference will be given to applications received before february 05, 2020, 23:59 cet."
